title,date,views,quantity
黄河交通学院2021年人才引进计划,2021-10-27,365,1
2022中国安全防伪证件研制中心校园招聘简章,2021-10-27,412,1
香港科技大学工学院研究生项目招生宣讲会,2021-10-27,351,1
闽南师范大学2021年诚纳英才,2021-10-26,342,1
中科南京智能技术研究院招聘简章,2021-10-26,393,1
广东机电职业技术学院、广东省博士工作站2021年博士研究生招聘公告,2021-10-26,344,1
中国科学院微电子研究所低功耗智能芯片与系统团队招聘,2021-10-26,374,1
江苏科技大学2021年诚聘海内外优秀人才,2021-10-26,354,1
重庆工程学院2021年高层次人才招聘简章,2021-10-26,350,1
启明信息技术股份有限公司,2021-10-26,395,1
科林电气2022校园招聘,2021-10-26,375,1
北银金融科技有限责任公司,2021-10-26,428,1
北银金融科技有限责任公司,2021-10-26,361,1
桂林理工大学2021年招聘计划,2021-10-26,358,1
广西科技大学,2021-10-26,359,1
【政府咨询项目助理】北京菁正咨询有限公司,2021-10-26,363,1
嘉应学院2021-2022年人才招聘启事,2021-10-26,345,1
中国科学院微电子研究所低功耗智能芯片与系统团队招聘,2021-10-26,371,1
深圳综合粒子设施研究院校园招聘公告,2021-10-26,347,1
中共河北省委党校（河北行政学院）2021年诚聘英才,2021-10-25,363,1
上海司南卫星导航技术股份有限公司,2021-10-25,364,1
2022中公教育校园招聘-考研讲师,2021-10-25,368,1
中国科学院赣江创新研究院2021年优秀博士招聘启事,2021-10-25,346,1
湖南生物机电职业技术学院2021年公开招聘,2021-10-25,353,1
哈尔滨工业大学人工智能研究院有限公司,2021-10-25,367,1
唱吧音乐集团2022秋季校园招聘,2021-10-25,375,1
哈尔滨工业大学人工智能研究院有限公司,2021-10-25,354,1
哈尔滨工业大学人工智能研究院有限公司,2021-10-25,355,1
哈尔滨工业大学人工智能研究院有限公司,2021-10-25,345,1
哈尔滨工业大学人工智能研究院有限公司,2021-10-25,359,1
哈尔滨工业大学人工智能研究院有限公司,2021-10-25,378,1
巴中职业技术学院2021年人才招聘,2021-10-25,364,1
江西工程学院2021年人才招聘,2021-10-25,354,1
山东高等技术研究院,2021-10-25,353,1
万华化学（福建）有限公司,2021-10-25,346,1
广聚人才 智汇八桂-广西大学欢迎你！优良学术保障、事业编制且有竞争力的薪酬待遇,2021-10-25,371,1
东北农业大学2021年下半年人才公开招聘公告,2021-10-24,358,1
嘉应学院2021-2022年人才招聘启事,2021-10-24,356,1
南京信息工程大学高端光电仪器及激光技术团队诚招青年教师和师资博后,2021-10-24,363,1
河北农业大学2021年选聘博士公告,2021-10-24,353,1
材料科学姑苏实验室2021年高层次人才招聘启事,2021-10-24,353,1
桂在珍惜 工候你来-桂林理工大学2021年诚邀优秀人才加盟,2021-10-24,365,1
石河子大学政法学院2022年人才招聘,2021-10-22,346,1
北京华龙通科技有限公司,2021-10-22,378,1
地太科特电子制造（北京）有限公司,2021-10-22,369,1
【综合1场&综合2场】高校人才网2021年秋冬季博士人才视频双选会邀请函,2021-10-22,576,1
万物云空间科技服务股份有限公司,2021-10-22,369,1
广州金融控股集团有限公司,2021-10-22,356,1
嘉入我们 庚进一步-厦门大学嘉庚学院2021-2022学年人才招聘启事,2021-10-22,351,1
北京博华信智科技股份有限公司,2021-10-21,369,1
北京博华信智科技股份有限公司,2021-10-21,363,1
北京博华信智科技股份有限公司,2021-10-21,375,1
北京博华信智科技股份有限公司,2021-10-21,377,1
北京海泰方圆科技股份有限公司,2021-10-21,371,1
北京卓利互娱科技有限公司,2021-10-21,358,1
央企华侨城集团公司2022校园招聘,2021-10-21,378,1
嘉里大通物流有限公司2022校园招聘,2021-10-21,322,1
中国科学院武汉岩土力学研究所科研岗位和特别研究助理（含博士后）招聘简章【长期有效】,2021-10-21,358,1
金川集团股份有限公司,2021-10-21,299,1
中国广电广州网络股份有限公司（原珠江数码）,2021-10-20,384,1
中国地震局地球物理研究所高层次人才引进公告,2021-10-20,390,1
浙江大学核医学创新研究中心招聘博士后,2021-10-20,353,1
中车信息技术有限公司,2021-10-20,414,1
西安交通大学城市学院诚聘英才,2021-10-20,368,1
北京未尔锐创科技有限公司,2021-10-20,309,1
万联证券股份有限公司,2021-10-19,373,1
中存大数据科技有限公司,2021-10-19,387,1
数码视讯2022届校招（26号宣讲会14：00-16:00）,2021-10-19,467,1
安捷中科（北京）数据科技有限公司,2021-10-19,368,1
360数科2022校园招聘启动啦！,2021-10-19,425,1
小米科技有限责任公司,2021-10-19,576,1
小米集团2022全球校园招聘-手机专场,2021-10-19,458,1
中科本原科技（北京）有限公司,2021-10-19,479,1
中国广电广州网络股份有限公司,2021-10-19,372,1
深圳酷派技术有限公司,2021-10-19,367,1
智能驾驶激光雷达领军企业—深圳市速腾聚创科技有限公司 2022校园招聘宣讲会（北京站）,2021-10-19,367,1
浙江物产环保能源股份有限公司,2021-10-19,360,1
2022中公教育校园招聘-教招讲师,2021-10-18,363,1
管理咨询顾问-北京、西安、深圳,2021-10-18,360,1
地太科特电子制造（北京）有限公司,2021-10-18,365,1
广州汇智通信技术有限公司 (中国电信集团旗下大型国企) 2022届校园招聘,2021-10-18,391,1
东方晶源微电子科技（北京）有限公司,2021-10-18,363,1
深圳综合粒子设施研究院校园招聘公告,2021-10-17,352,1
中科南京智能技术研究院招聘简章,2021-10-17,369,1
清华大学材料课题组招聘热电/热障/结构陶瓷博士后,2021-10-17,355,1
中国南方电网有限责任公司2022年校园招聘公告,2021-10-16,413,1
九号公司2022校园招聘简章 ——“让起步更酷”,2021-10-15,376,1
图灵深视（北京）科技有限公司,2021-10-15,368,1
中信证券股份有限公司杭州凤起路证券营业部,2021-10-15,356,1
ASM先进科技（中国）有限公司2022校园招聘（成都）,2021-10-15,390,1
中国技术进出口集团有限公司,2021-10-15,425,1
中国科学院微电子研究所低功耗智能芯片与系统团队招聘,2021-10-14,440,1
中国石化上海石油化工研究院2021年人才招聘,2021-10-14,441,1
携程计算机技术（上海）有限公司,2021-10-14,469,1
超星集团2021秋季校园招聘（全国）,2021-10-14,482,1
东风南方集团【央企】联友科技22届秋季校园招聘,2021-10-14,450,1
成都思科瑞微电子股份有限公司,2021-10-14,373,1
苏州苏驼通信科技股份有限公司,2021-10-14,372,1
苏州苏驼通信科技股份有限公司,2021-10-14,540,1
西安电子科技大学杭州研究院2021年全球招聘引才公告,2021-10-14,386,1
广东省工业设备安装有限公司,2021-10-14,463,1
白城医学高等专科学校2021年招聘高层次人才公告,2021-10-13,410,1
滨州学院2021年诚聘海内外优秀人才,2021-10-13,439,1
洛阳师范学院2021年高层次人才引进政策及计划,2021-10-13,448,1
南方基金2022届秋季校园招聘,2021-10-13,377,1
深圳市光明区科技创新服务中心2021年博士后招聘简章,2021-10-13,360,1
锐方（上海）私募基金管理有限公司招聘,2021-10-13,367,1
东南数字经济发展研究院,2021-10-13,372,1
中国科学院软件研究所中国科学院软件研究所2022年度校园招聘简章,2021-10-13,523,1
北京市地铁运营有限公司,2021-10-13,393,1
衢州职业技术学院高层次人才引进公告,2021-10-12,382,1
北京五一视界数字孪生科技股份有限公司,2021-10-12,459,1
给梦想一颗澎湃的芯 ——芯动科技校园线上招聘（2021秋季）,2021-10-12,424,1
中交信息技术国家工程实验室有限公司,2021-10-12,532,1
北京流马锐驰科技有限公司,2021-10-12,442,1
北京大学长三角光电科学研究院招聘启事,2021-10-12,424,1
河南科技大学2021年诚聘优秀人才,2021-10-12,431,1
辽宁交投艾特斯智能交通技术有限公司,2021-10-12,397,1
广东省新一代通信与网络创新研究院2022届毕业生招聘,2021-10-12,399,1
北京机械工业自动化研究所有限公司,2021-10-12,414,1
360数科2022校园招聘启动啦！,2021-10-12,371,1
中国科协创新战略研究院2021年秋冬季博士人才现场招聘会,2021-10-12,402,1
上海科技大学2021年秋冬季博士人才现场巡回招聘会,2021-10-12,475,1
渤海大学2021年秋冬季博士人才现场巡回招聘会,2021-10-12,444,1
上海航天八院802所2022届校园招聘,2021-10-12,501,1
南瑞集团有限公司2022届毕业生招聘简章,2021-10-11,483,1
成都精灵云科技有限公司,2021-10-11,417,1
中国科学院武汉岩土力学研究所,2021-10-11,384,1
英国豪迈国际有限公司上海代表处,2021-10-11,391,1
中资网络信息安全科技有限公司2022校招正式启动！,2021-10-11,430,1
哈尔滨工业大学人工智能研究院有限公司,2021-10-11,392,1
北京知本创业管理咨询有限公司,2021-10-11,389,1
衍盛中国2021秋季招聘校园行,2021-10-11,408,1
广西科技师范学院招聘简章,2021-10-11,388,1
中国网安（含中国电科三十所）2022届校园招聘,2021-10-11,444,1
中联重科应急装备事业部2021年社会招聘简章,2021-10-11,400,1
北京晟芯网络科技有限公司,2021-10-11,401,1
中科南京智能技术研究院招聘简章,2021-10-11,401,1
启明信息技术股份有限公司,2021-10-10,420,1
重庆邮电大学2021-2022年招聘,2021-10-10,472,1
台州学院高等研究院—智能信息处理研究所招聘启事,2021-10-10,368,1
厦门工学院2021年教师招聘启事,2021-10-10,396,1
中国科学院微电子研究所低功耗智能芯片与系统团队招聘,2021-10-10,402,1
苏州大学未来校区人才招聘公告,2021-10-10,398,1
东北农业大学2021年下半年人才公开招聘公告,2021-10-10,425,1
中国科学院长春应用化学研究所2021年度招聘启事,2021-10-10,400,1
苏州系统医学研究所高层次人才招聘公告,2021-10-10,375,1
广东医科大学2021年招聘高层次人才公告,2021-10-10,372,1
广东医科大学2021年人才招聘公告,2021-10-10,387,1
牧原食品股份有限公司,2021-10-10,387,1
长江养老2022校园招聘正式开启,2021-10-09,427,1
暨南大学附属第一医院最高年薪66万+招聘博士后,2021-10-09,464,1
北京国联视讯信息技术股份有限公司,2021-10-09,451,1
四川剑南春（集团）有限责任公司,2021-10-09,443,1
光大科技有限公司,2021-10-09,469,1
广东科学技术职业学院2021年高层次人才招聘公告,2021-10-09,415,1
河北民族师范学院2021年博士研究生公开选聘启事,2021-10-09,410,1
广东医科大学招聘高层次人才公告,2021-10-09,394,1
东北电力大学博士后招聘启事,2021-10-09,398,1
中山大学数学学院(珠海)诚聘英才,2021-10-09,413,1
上海人工智能创新中心,2021-10-09,387,1
上海人工智能创新中心,2021-10-09,434,1
新瑞鹏宠物医疗集团有限公司,2021-10-09,400,1
小米集团2022全球校园招聘全面启动！,2021-10-09,476,1
中国科学院上海巴斯德研究所2021年度招聘启事,2021-10-09,403,1
数码视讯科技集团2022届校园招聘,2021-10-08,398,1
南京理工大学教师招聘,2021-10-08,572,1
CNH集团--晨皓知识产权 2022届校园招聘简章,2021-10-08,357,1
财达证券2022校园招聘简章,2021-10-08,475,1
蓝诺微银（北京）信息技术有限公司,2021-10-08,380,1
木瓜移动2022校园招聘全面开启~,2021-10-08,441,1
中国人民解放军第五七二〇工厂2022年校园招聘,2021-10-03,442,1
中国科学院国家空间科学中心,2021-10-01,411,1
中国科学院国家空间科学中心2022年特别研究助理招聘启事,2021-10-01,404,1
【唯品会】“唯有少年，年少有唯”,2021-09-30,475,1
中国科学院微电子研究所2021年招聘公告,2021-09-30,564,1
招聘|中国电信股份有限公司内蒙古分公司2022校园招聘,2021-09-30,438,1
北京屿渡翻译有限责任公司,2021-09-30,439,1
西安纸贵互联网科技有限公司,2021-09-30,463,1
杭州科技职业技术学院2021年公开招聘高层次人才及青年教师,2021-09-30,527,1
西安三星电子研究有限公司,2021-09-30,538,1
广东科技学院公开招聘教师,2021-09-30,550,1
（浙江）丽水学院2021年下半年人才招信息,2021-09-30,498,1
北京天澜智慧知识产权代理有限公司,2021-09-30,514,1
2022中公教育校园招聘-考研讲师,2021-09-30,465,1
（世界500强）物产中大金属集团2022届校园招聘,2021-09-30,652,1
华中农业大学公共管理学院2021年秋冬季博士人才现场招聘会,2021-09-30,458,1
热招：IT互联网高端猎头顾问/管培生（欢迎转行，欢迎应届生，北京朝阳门包住）,2021-09-30,311,1
内蒙古大学2021年秋冬季博士人才现场巡回招聘会,2021-09-30,343,1
北京全路通信信号研究设计院集团有限公司,2021-09-30,357,1
上海汉得信息技术股份有限公司,2021-09-30,299,1
福建新大陆支付科技有限公司,2021-09-29,446,1
南京摄星智能科技有限公司,2021-09-29,525,1
上海电气集团股份有限公司,2021-09-29,493,1
上海海隆软件2022届校园招聘,2021-09-29,463,1
华南师范大学阿伯丁数据科学与人工智能学院2021年教师招聘公告,2021-09-29,436,1
北京理工大学宇航学院波动力学实验室2021年招聘博士后人员公告,2021-09-29,435,1
中国科学院空间应用工程与技术中心集成技术中心2021年招聘简章,2021-09-29,553,1
中信中证投资服务有限责任公司2022届校园招聘,2021-09-29,479,1
中科慧远视觉技术(洛阳)有限公司,2021-09-29,459,1
健帆生物科技集团股份有限公司,2021-09-29,439,1
北京中科闻歌科技股份有限公司2022届校招,2021-09-29,511,1
成都大学人才招聘启事,2021-09-28,491,1
北京飞斯科科技有限公司,2021-09-28,493,1
华润万象商业（深圳）有限公司华北分公司,2021-09-28,457,1
北京百事强贸易有限责任公司,2021-09-28,436,1
河南科技学院2021年诚聘优秀博士人才,2021-09-28,441,1
一汽解放汽车有限公司2022年秋季校园招聘,2021-09-28,443,1
贵州航天计量测试技术研究所,2021-09-28,452,1
北京交通大学国家经济安全研究院2021年秋冬季博士人才现场招聘会,2021-09-28,463,1
北京亚控科技发展有限公司,2021-09-28,476,1
广西科技大学2021-2022年面向海内外诚聘优秀人才,2021-09-27,397,1
数码视讯科技集团2022届校园招聘,2021-09-27,414,1
中国热带农业科学院南亚热带作物研究所湛江站实验站2021年博士研究生人员岗位公开招聘公告,2021-09-27,386,1
福建省招标采购集团有限公司2022届校园招聘,2021-09-27,386,1
澳門大學智慧城市物聯網國家重點實驗室招聘,2021-09-27,379,1
广州金升阳科技有限公司,2021-09-27,390,1
广州金升阳科技有限公司2022&2023届秋季校园招聘,2021-09-27,390,1
中国工商银行股份有限公司广东省分行,2021-09-27,393,1
台州职业技术学院2021年柔性引进人才公告,2021-09-27,417,1
一汽解放汽车有限公司2022年秋季校园招聘,2021-09-27,410,1
度小满科技（北京）有限公司,2021-09-27,478,1
山东经贸职业学院2021年公开招聘博士研究生及高级岗位工作人员简章,2021-09-27,423,1
启元世界（北京）信息技术服务有限公司,2021-09-27,556,1
国家工信安全中心（工信部电子一所）2022校园招聘,2021-09-27,638,1
东北电力大学2021年秋季招聘公告,2021-09-27,466,1
江苏医药职业学院2021年拟公开招聘计划,2021-09-26,394,1
聚海内外英才，谋山一大未来-山东第一医科大学（山东省医学科学院） 诚邀海内外青年才俊参加2021国际青年学者论坛,2021-09-26,406,1
浙江中泽精密科技有限公司,2021-09-26,391,1
中国电建集团河北省电力勘测设计研究院有限公司2022年校园招聘公告,2021-09-26,425,1
（浙江）丽水学院2021年下半年人才招聘启事,2021-09-26,387,1
湖南泛联新安信息科技有限公司,2021-09-26,408,1
曲阜师范大学统计学院2021年度诚聘海内外英才,2021-09-26,390,1
厦门银行股份有限公司2022年校园招聘,2021-09-26,392,1
中国船舶第八研究院（扬州院区·原七二三所）诚聘人才公告,2021-09-26,387,1
东北电力大学2021年秋季招聘公告,2021-09-26,396,1
上海浦东发展银行股份有限公司长沙分行,2021-09-26,393,1
北京星际防务科技有限公司,2021-09-25,406,1
意昂—郑州中原国际汽车研究院2022校园招聘,2021-09-25,393,1
西安翔腾微电子科技有限公司,2021-09-25,409,1
宿迁学院2021年高层次人才招聘公告,2021-09-24,416,1
北大医疗信息技术有限公司,2021-09-24,437,1
22届毕业生，医疗仪器行业offer待查！,2021-09-24,419,1
2021年宁波幼儿师范高等专科学校（宁波教育学院）公开招聘高层次人才5名,2021-09-24,395,1
上海开域信息科技有限公司2022届财务类校招,2021-09-24,411,1
诺贝尔瓷砖2022校园招聘,2021-09-24,398,1
世界500强企业-泰康人寿总公司2022年全球校园招聘,2021-09-24,517,1
武汉纺织大学外经贸学院2021年招聘,2021-09-24,414,1
哈尔滨工业大学（威海）2021年专任教师（非思政类）岗位招聘,2021-09-24,403,1
锐方（上海）私募基金管理有限公司,2021-09-24,390,1
北京理工大学2021年秋冬季博士人才现场招聘会,2021-09-24,435,1
浙江物产环保能源股份有限公司,2021-09-24,385,1
张江实验室光子芯片研发部博士后招聘公告,2021-09-23,411,1
葛洲坝集团交通投资有限公司2021年校园招聘简章,2021-09-23,411,1
贝壳找房2022届省区ADC校园招聘简章,2021-09-23,409,1
西安翔腾微电子科技有限公司,2021-09-23,413,1
燕山大学2021年公开招聘专职研究人员公告,2021-09-23,431,1
中电科风华信息装备股份有限公司,2021-09-23,400,1
2022中公教育校园招聘-管培生,2021-09-23,396,1
北京国双科技有限公司,2021-09-23,457,1
公诚管理咨询有限公司,2021-09-23,412,1
公诚管理咨询有限公司-通信监理工程师,2021-09-23,413,1
上海开域信息科技有限公司2022届校招,2021-09-23,452,1
亚信科技2022应届生招聘 ——新科技 信未来,2021-09-23,486,1
山东高等技术研究院2021秋季招聘启事,2021-09-23,435,1
西南医科大学2021年校本部全职引进博士,2021-09-23,413,1
中国联通四川省分公司2021年（2022届）秋季校园招聘公告（第一批）,2021-09-23,500,1
复旦大学生命科学学院冯喆课题组2021年诚聘博士后、科研助理,2021-09-23,453,1
广西师范大学2021年人才招聘公告,2021-09-23,416,1
北京多彩互动广告有限公司,2021-09-23,425,1
中建七局总承包有限公司,2021-09-23,460,1
延安大学2021年教师岗位招聘,2021-09-23,413,1
中国科学院光电技术研究所2022年招聘公告,2021-09-23,464,1
衢州学院2021年下半年高层次人才招聘,2021-09-23,403,1
地产8强—新城控股2021新睿全球校招启动,2021-09-23,406,1
中安威士（北京）科技有限公司,2021-09-23,442,1
北京理工雷科电子信息技术有限公司,2021-09-22,485,1
搜狐畅游2022秋季校园招聘,2021-09-22,446,1
数码视讯科技集团2022届校园招聘,2021-09-22,434,1
广东宽普科技有限公司,2021-09-22,431,1
深圳市松鼠教育科技有限公司,2021-09-22,415,1
中国网安（含中国电科三十所）2022届校园招聘,2021-09-22,475,1
浙江省机电技师学院2021年教师招聘计划,2021-09-22,407,1
杭州谱育科技发展有限公司,2021-09-22,425,1
上海司南卫星导航技术股份有限公司2022届校园招聘,2021-09-22,404,1
华南农业大学珠江学院2021年下半年教职工招聘,2021-09-22,412,1
宁波财经学院2021年高层次人才招聘,2021-09-22,409,1
恰少年时 智领新时代-神思电子2022届校园招聘,2021-09-22,401,1
内蒙古大学常年引进高层次人才公告（中英文版）,2021-09-22,431,1
北京北航天宇长鹰无人机科技有限公司,2021-09-21,752,1
虹科电子2022届秋季校园招聘,2021-09-21,544,1
石家庄铁道大学2021年人才招聘公告,2021-09-20,473,1
 西南医科大学附属口腔医院2021年招聘简章,2021-09-18,675,1
烽台科技（北京）有限公司,2021-09-18,481,1
清华大学能源与动力工程系颗粒与燃烧研究组2021年博士后招聘,2021-09-18,427,1
南京途善久文化传播有限公司,2021-09-18,429,1
中国科学院深海科学与工程研究所2021年招聘启事,2021-09-18,496,1
电子科技大学成都学院教学资源部数据工程师招聘公告,2021-09-18,717,1
中国航空综合技术研究所2022校园招聘,2021-09-18,634,1
长春长光辰芯光电技术有限公司,2021-09-17,421,1
武汉达梦数据库股份有限公司,2021-09-17,442,1
国汽智控（北京）科技有限公司,2021-09-17,470,1
中国科学院上海光学精密机械研究所2021年博士后招聘启事,2021-09-17,445,1
汉王科技股份有限公司,2021-09-17,459,1
Longer Pump-软件工程师,2021-09-17,439,1
中信网络有限公司,2021-09-17,500,1
华硕科技（苏州）有限公司,2021-09-17,460,1
北京脑陆科技有限公司,2021-09-17,418,1
索菲亚集团2022届校园招聘,2021-09-16,431,1
中交基础设施养护集团有限公司,2021-09-16,436,1
才汇紫金 宁聚梦想 ——网络通信与安全紫金山实验室2022届校园招聘正式启动,2021-09-16,437,1
南京信息工程大学海洋人才特区2021年招聘启事,2021-09-16,430,1
桂林力源粮油食品集团有限公司,2021-09-16,416,1
唐山市环境规划科学研究院（唐山市生态环境宣传教育中心）2022届校园招聘,2021-09-16,427,1
中电智能科技有限公司,2021-09-16,492,1
远东控股集团有限公司,2021-09-16,420,1
华芯巨数（杭州）微电子有限公司,2021-09-16,429,1
乐玩新大地（北京）科技有限公司,2021-09-16,446,1
香港科技大学22fall数据建模硕士学位项目宣讲会,2021-09-15,455,1
福建工程学院2022年师资招聘,2021-09-15,441,1
北京和利时系统工程有限公司,2021-09-15,453,1
广州华立学院（广州校区）2021年教师招聘启事,2021-09-15,432,1
中国五矿集团有限公司2022年度校园招聘,2021-09-15,507,1
广州华立学院（广州校区）2021年教师招聘启事,2021-09-15,433,1
无锡中感微电子有限公司,2021-09-15,448,1
杭州趣链科技有限公司,2021-09-15,442,1
邯郸学院2021年公开选聘博硕人才,2021-09-15,450,1
交通运输部天津水运工程科学研究所,2021-09-15,434,1
深圳市民德电子科技股份有限公司,2021-09-15,429,1
英诺赛科（苏州）半导体有限公司,2021-09-15,434,1
“智汇南山·职为你来”深圳市南山区千企万岗线上招聘会简介,2021-09-15,424,1
中国人寿保险股份有限公司研发中心2022年校园招聘公告,2021-09-15,523,1
厦门二维进化网络技术有限公司,2021-09-15,302,1
中建二局一公司2022校园精英招聘,2021-09-14,472,1
高层次人才网秋冬季博士专场网络视频双选会,2021-09-14,496,1
无量科技股份有限公司,2021-09-14,468,1
浪潮集团2022届校园招聘,2021-09-14,520,1
北大医信2022届校园招聘,2021-09-14,463,1
中国科学院深圳先进技术研究院2021年博士后招聘公告,2021-09-14,452,1
中国银联博士后科研工作站2022年度博士后招收简章,2021-09-14,441,1
芯视界（北京）科技有限公司,2021-09-14,479,1
福建工程学院2022年师资招聘计划,2021-09-14,422,1
北京微纳星空科技有限公司,2021-09-14,458,1
贵阳市创业投资有限公司,2021-09-14,447,1
浙江财经大学东方学院2021年专任教师招聘简章 ,2021-09-14,428,1
中国国际贸易促进委员会专利商标事务所,2021-09-14,408,1
浙江大学NGICS大平台2021年博士后招聘启事,2021-09-14,430,1
苏州雄立科技有限公司,2021-09-14,420,1
中建三局2022“争先之星”校园招聘简章,2021-09-13,449,1
山东省科学院海洋仪器仪表研究所2021年招聘信息,2021-09-13,467,1
高层次人才网秋冬季博士专场网络视频双选会,2021-09-13,450,1
扬州宇安电子科技有限公司,2021-09-13,429,1
中铁投资集团有限公司,2021-09-13,592,1
北京数势云创科技有限公司,2021-09-13,456,1
数码视讯科技集团2022届校园招聘,2021-09-13,486,1
中国科学院武汉岩土力学研究所科研岗位和特别研究助理（含博士后）招聘简章【长期有效】,2021-09-13,458,1
武汉烽火国际技术有限责任公司 校园招聘（2022海外精英计划）,2021-09-13,468,1
中国电子科技集团公司第三十八所,2021-09-13,498,1
中国电子科技集团公司第三十八所 2022秋季招聘,2021-09-13,525,1
北京爱学习博乐教育科技有限公司,2021-09-13,456,1
【佳能医疗】研发岗校园招聘,2021-09-13,487,1
创新奇智2022年校园招聘,2021-09-13,471,1
特来电（北京）新能源科技有限公司,2021-09-13,467,1
杭州火奴数据科技有限公司2022校园招聘,2021-09-13,454,1
正青春 创未来|广州联通2022届校园招聘,2021-09-13,454,1
富士康工业互联网股份有限公司2022校园招聘简章,2021-09-13,410,1
内蒙古科技大学机械工程学院博（硕）士及高层次人才招聘,2021-09-10,436,1
