title,date,views,quantity
南通大学信息科学技术学院2021年人才招聘公告,2021-09-10,457,1
宇通集团2022届校园招聘简章,2021-09-10,446,1
青岛上合航天科技有限公司,2021-09-10,483,1
北京航空航天大学合肥创新研究院2021年人才招聘启事,2021-09-10,458,1
大唐高鸿2022年校园招聘信息,2021-09-10,504,1
芯无界. 至未来   和芯星通2022校园招聘,2021-09-10,447,1
恰青春，正当燃—当当网2022校园招聘公告,2021-09-10,454,1
广东赛微微电子股份有限公司,2021-09-10,440,1
汇蓉国科2022届梧桐树计划,2021-09-10,490,1
厦门理工学院2021年公开招聘高层次人才启事,2021-09-10,430,1
荣盛盟固利新能源科技股份有限公司,2021-09-10,486,1
芯讯通无线科技（上海）有限公司,2021-09-10,467,1
“乘风而上，未来有你” ——天风证券2022届校园招聘简章,2021-09-10,415,1
陕西千山航空电子有限责任公司,2021-09-09,444,1
北京北方华创微电子装备有限公司,2021-09-09,441,1
北京北方华创微电子装备有限公司,2021-09-09,443,1
北京中科科仪股份有限公司2022届校园招聘,2021-09-09,436,1
北京西云数据科技有限公司,2021-09-09,435,1
浙江运达风电股份有限公司,2021-09-09,471,1
【世界500强】浙江物产环保能源股份有限公司 2022校园招聘简章,2021-09-09,439,1
航天恒星科技有限公司,2021-09-09,544,1
华南农业大学珠江学院下半年教职工招聘,2021-09-09,427,1
许昌学院2021年诚聘海内外高层次人才,2021-09-09,441,1
亳州学院2021年高层次人才招聘,2021-09-09,439,1
中国科学院信息工程研究所2021-2022年招聘启事,2021-09-09,546,1
前海再保险股份有限公司博士后创新实践基地2021年秋季招聘公告,2021-09-09,432,1
深圳市环波科技有限责任公司,2021-09-09,438,1
上海东软载波微电子有限公司,2021-09-09,440,1
华南理工大学2021年博士后和专职研究人员,2021-09-09,450,1
中铁物贸集团有限公司,2021-09-08,487,1
中国电信天翼物联科技有限公司2022年校园招聘,2021-09-08,522,1
广州乐牛软件科技有限公司,2021-09-08,486,1
苏州旭创科技2022年校招,2021-09-08,461,1
河南投资集团有限公司,2021-09-08,460,1
北京阿凡提互娱科技有限公司,2021-09-08,465,1
中科曙光2022届校园招聘简章,2021-09-08,561,1
智慧互通（AIPARK）2022校园招聘,2021-09-08,556,1
北京智源人工智能研究院,2021-09-08,479,1
北京海量数据技术股份有限公司,2021-09-08,278,1
深圳农村商业银行股份有限公司,2021-09-08,421,1
北京海量数据技术股份有限公司,2021-09-08,280,1
深圳市兴海物联科技有限公司,2021-09-08,426,1
浙江诺诺网络科技有限公司,2021-09-08,432,1
九洲集团2022年校园招聘简章,2021-09-08,432,1
青岛上合航天科技有限公司,2021-09-08,413,1
南京国兆光电科技有限公司,2021-09-08,437,1
北京智一科技校园招聘——全职岗位,2021-09-08,445,1
北京字节跳动科技有限公司,2021-09-08,564,1
武汉文理学院2021年秋季教师招聘启事,2021-09-07,451,1
厦门大学嘉庚学院2020-2021学年人才招聘启事,2021-09-07,427,1
晨山（北京）企业管理咨询有限公司,2021-09-07,438,1
浙江大学环境与资源学院吴忠标教授课题组2021年博士后招聘启事,2021-09-07,428,1
浙江大学环境与资源学院吴忠标教授课题组2021年博士后招聘启事,2021-09-07,421,1
中国电子科技网络信息安全有限公司,2021-09-07,466,1
SGS通标标准技术服务有限公司质优生招聘,2021-09-07,453,1
北京数码视讯科技股份有限公司,2021-09-07,440,1
深圳雅学科技有限公司2021年下半年招聘,2021-09-07,435,1
深圳市纽创信安科技开发有限公司,2021-09-07,429,1
中国船舶工业综合技术经济研究院2022年校园招聘,2021-09-07,505,1
牛津（海南）区块链研究院有限公司,2021-09-07,470,1
平安银行深圳分行2022届秋季校园招聘宣传,2021-09-07,434,1
中通快递股份有限公司,2021-09-07,459,1
中国通信建设集团有限公司,2021-09-07,510,1
西北工业大学无人机所2022校园招聘,2021-09-07,458,1
中建城市建设发展有限公司,2021-09-07,482,1
集佳知识产权2022校园招聘,2021-09-07,492,1
“才聚淄博”小程序-淄博市人社局推出,2021-09-07,465,1
牧原食品股份有限公司,2021-09-07,439,1
中电科思仪科技股份有限公司（40/41所） 2022校园招聘,2021-09-07,480,1
南京晓庄学院2021年度公开招聘人才公告,2021-09-06,442,1
北京月生信息技术有限公司,2021-09-06,467,1
九江学院2021年高层次人才招聘公告,2021-09-06,428,1
普源精电科技股份有限公司（RIGOL）2022校园招聘简章,2021-09-06,449,1
广州市中大管理咨询有限公司,2021-09-06,435,1
“碳”索未来 瑞力无限南瑞集团有限公司2022届毕业生招聘简章,2021-09-06,454,1
东风本田汽车有限公司招聘简章,2021-09-06,433,1
帆软软件有限公司,2021-09-06,432,1
楚雄师范学院2021年博士招聘简章,2021-09-06,434,1
山东淄博人才金政，邀您携手共创未来,2021-09-06,440,1
东方剑桥集团,2021-09-06,450,1
广东智能无人系统研究院2022年校园招聘公告,2021-09-06,468,1
福建工程学院2021年师资招聘计划,2021-09-06,430,1
内蒙古蒙牛乳业（集团）股份有限公司,2021-09-06,453,1
中航航空模拟系统有限公司,2021-09-06,464,1
上海唯捷创芯电子技术有限公司,2021-09-06,446,1
一汽奔腾2022全球校园招聘,2021-09-06,484,1
苏州新东方培训学校有限公司,2021-09-06,445,1
高校人才网2021年秋冬季博士人才现场巡回招聘会&视频双选会邀请函,2021-09-06,456,1
西云数据2022校园招聘,2021-09-06,458,1
北京时代传浮科技有限公司,2021-09-06,452,1
北京时代传浮科技有限公司,2021-09-06,459,1
深圳哈稀网络技术有限公司,2021-09-06,460,1
北京时代传浮科技有限公司,2021-09-06,450,1
中国外运2022校园招聘,2021-09-06,477,1
南京晓庄学院2021年度公开招聘人才公告,2021-09-05,425,1
广东省电信规划设计院有限公司北京分院2022校园招聘,2021-09-05,466,1
中国科学院沈阳自动化研究所2021-2022年校园招聘,2021-09-04,540,1
特变电工沈阳变压器集团有限公司2022届校园招聘,2021-09-04,472,1
一汽解放青岛汽车有限公司,2021-09-03,403,1
2022秋招 - 亚马逊中国综合管理类职位,2021-09-03,528,1
中国移动江西公司2021年校园招聘,2021-09-03,477,1
锐捷网络2022届校园招聘简章,2021-09-03,488,1
启明信息技术股份有限公司2022年校园招聘简章,2021-09-03,471,1
芯无界. 至未来   和芯星通2022校园招聘,2021-09-03,484,1
荣聚新势力 启航新征程——荣程集团22届荣耀青年招聘简章,2021-09-03,468,1
北京亚控科技发展有限公司2022届校园招聘简章,2021-09-03,498,1
邯郸制药股份有限公司,2021-09-03,474,1
清华大学精密仪器系智能微系统实验室2021年招聘 自动控制/仪器科学/航空航天/计算机等领域博士后,2021-09-03,483,1
中国科学院沈阳自动化研究所2021-2022年校园招聘,2021-09-03,518,1
西安诺瓦星云科技股份有限公司,2021-09-03,494,1
【鼎阳科技】和光同行，为你而来！2022届校园招聘正在进行中,2021-09-03,473,1
超越科技股份有限公司,2021-09-03,501,1
龙湖集团2022届仕官生校园招聘启动&空宣来袭！——向上，仕不可挡！,2021-09-03,495,1
浙江臻镭科技股份有限公司,2021-09-03,493,1
珠海亿智电子科技有限公司,2021-09-03,454,1
方寸之间，科技之上—— 方太集团2022届校园招聘,2021-09-03,473,1
斯伦贝谢技术(北京)有限公司,2021-09-03,447,1
广州海格通信集团股份有限公司,2021-09-02,459,1
中建三局信息技术研究院2022校园招聘,2021-09-02,493,1
宁夏隆基宁光仪表股份有限公司,2021-09-02,446,1
海信集团2022届校园招聘简章,2021-09-02,509,1
珠海剑心互动娱乐有限公司,2021-09-02,451,1
四川天味食品集团股份有限公司,2021-09-02,450,1
中国移动（上海）产业研究院2022校园招聘正式启动,2021-09-02,479,1
迪士尼(Disney)全资在线视频公司 Disney+ Hotstar 2022年校园招聘,2021-09-02,490,1
中国人民解放军第五七一八工厂2022届秋季校园招聘,2021-09-02,588,1
清华大学智能社会治理研究院2021年实习生招聘通知,2021-09-02,462,1
中国科学院工程热物理研究所2021年招聘公告,2021-09-02,514,1
北京品驰医疗设备有限公司,2021-09-02,473,1
SGS通标标准技术服务有限公司质优生招聘,2021-09-02,449,1
绿盟科技集团股份有限公司,2021-09-02,482,1
山东五征集团有限公司,2021-09-02,457,1
中国船舶第八研究院（南京）2022届校园招聘,2021-09-02,553,1
埃里斯克矿山工程机械(北京）有限公司,2021-09-02,462,1
埃里斯克矿山工程机械(北京）有限公司,2021-09-02,429,1
曼迪匹艾（北京）科技服务有限公司,2021-09-02,536,1
昆明心霖公社教育中心2022届校园招聘简章,2021-09-02,491,1
