title,date,views,quantity
新疆理工学院2021年秋季面向社会公开招聘教师、辅导员,2021-11-30,347,180
远洋集团2022届校园招聘,2021-11-30,363,5
荣聚新势力 启航新征程 ——荣程集团22届荣耀青年招聘简章,2021-11-30,351,100
2022届赛尔网络有限公司校园招聘简章,2021-11-30,373,162
潍柴2022年校园招聘扩招简章,2021-11-30,393,1
齐鲁工业大学（山东省科学院）海洋技术科学学院招聘信息,2021-11-30,348,1
中科南京智能技术研究院招聘简章,2021-11-30,376,1
三环集团2022届秋季校园招聘,2021-11-30,378,1
ASM先进科技2022校园招聘补录,2021-11-30,428,20
教师（博士）,2021-11-29,357,10
教师（硕士）,2021-11-29,362,15
鄂托克旗2021年引进高层次人才的公告,2021-11-26,377,19
衡水学院2021年招聘公告,2021-11-26,381,50
石家庄学院选聘博士,2021-11-26,365,30
安徽师范大学2021年度人才招聘,2021-11-26,369,115
常州信息职业技术学院2021年公开招聘高层次人员,2021-11-26,354,115
东华大学民用航空复合材料协同创新中心2021年招聘启事,2021-11-26,347,14
宁波国君源泓投资管理有限公司是在中国基金业协会备案的私募股权基金管理人，招聘网络信息安全投资经理和研究员,2021-11-26,365,3
中国电子科技集团公司第十一研究所,2021-11-26,474,50
小鹏汽车2022校园招聘“探索者计划”,2021-11-26,434,1000
广芯电子技术(上海)股份有限公司校招信息,2021-11-26,372,20
第三届“科技绵州 人才飞阳”四川省绵阳市招才引智 “云揽才”系列活动正式开启,2021-11-26,386,1000
汇聚天下英才 共创钱江时代 杭州市钱江新城投资集团2022届校园招聘,2021-11-26,370,80
宁波国君源泓投资管理有限公司是在中国基金业协会备案的私募股权基金管理人，网络信息安全行业研究员和投资经理招聘,2021-11-25,363,3
江西应用科技学院人才招聘,2021-11-24,380,216
首都师范大学2021年博士后科研人员招收公告,2021-11-23,327,1
面向理工科招聘-北京同达信恒知识产权代理有限公司,2021-11-23,331,1
2022中公教育校园招聘,2021-11-23,353,1
鼎道智联2022届校园招聘简章,2021-11-23,365,1
第一创业证券股份有限公司,2021-11-23,426,1
中国地震局地球物理研究所高层次人才引进公告,2021-11-22,381,1
北京巴别时代科技有限公司-巴别时代2022校招,2021-11-22,366,1
【哈尔滨站&长春站】高校人才网2021年秋冬季博士人才视频双选会邀请函,2021-11-22,374,1
锐方（上海）私募基金管理有限公司招聘,2021-11-22,355,1
哈药集团股份有限公司,2021-11-22,366,1
商业航天明星企业【零壹空间】空中宣讲来啦！！,2021-11-22,355,1
天津雀巢有限公司,2021-11-22,368,1
杭州科技职业技术学院2021年下半年公开招聘高层次人才及青年教师,2021-11-22,373,1
重庆公共运输职业学院学生教官招聘,2021-11-22,369,1
北京市联德律师事务所校招,2021-11-22,307,1
南京工业大学第四届“探•智”国际青年学者论坛-电控学院分论坛诚邀海内外英才参加,2021-11-22,322,1
西安工业大学新能源科学与技术研究院2021招聘简章,2021-11-22,321,1
深圳大学广东省海洋藻类开发与应用工程重点实验室博士后招聘,2021-11-22,314,1
北京大学化学与分子工程学院纳米结构功能材料课题组招聘优秀人才,2021-11-22,319,1
闽江学院2021下半年度高层次人才招聘公告,2021-11-22,327,1
台州学院高等研究院—智能信息处理研究所招聘启事,2021-11-22,321,1
青岛海信微联信号有限公司2022届校园招聘,2021-11-21,360,1
九江学院2021年高层次人才招聘公告,2021-11-21,333,1
武汉东湖学院高层次（高学历）人才招聘公告,2021-11-21,347,1
中国科学院天津工业生物技术研究所体外合成生物学中心游淳课题组招聘启事,2021-11-21,340,1
中国科学院微电子研究所低功耗智能芯片与系统团队招聘,2021-11-19,394,1
嘉应学院2021-2022年人才招聘启事,2021-11-19,379,1
重庆邮电大学2021-2022年招聘启事,2021-11-19,399,1
台州学院高等研究院——智能信息处理研究所招聘启事,2021-11-19,363,1
白城医学高等专科学校2021年招聘高层次人才公告,2021-11-19,358,1
广东省电信规划设计院有限公司北京分院2022校园招聘,2021-11-19,423,1
工业和信息化部网络安全产业发展中心（工业和信息化部信息中心）,2021-11-19,525,1
宽带资本,2021-11-19,380,1
2022南京理工大学江阴校区教师招聘,2021-11-19,361,1
虹科电子,2021-11-19,366,1
途家网网络技术（北京）有限公司,2021-11-19,359,1
北方自动控制技术研究所2021年招聘启事,2021-11-19,376,1
WorldQuant世坤2022软件工程师招聘,2021-11-19,363,1
超星集团2021秋季校园招聘（全国）,2021-11-19,372,1
中山大学数学学院（珠海）教师招聘启事,2021-11-19,369,1
广芯电子技术（上海）股份有限公司,2021-11-19,377,1
重庆川仪控制系统有限公司上海分公司,2021-11-19,359,1
国家计算机网络应急技术处理协调中心安徽分中心2022年度公开招聘公告,2021-11-19,337,1
中国农业银行博士后科研工作站2022年度招收博士后研究人员公告,2021-11-19,364,1
山东省科学院海洋仪器仪表研究所齐鲁工业大学（山东省科学院）海洋技术科学学院招聘,2021-11-18,326,1
丽水学院2021年下半年人才招聘启事,2021-11-18,324,1
南京信息工程大学高端光电仪器及激光技术团队诚招青年教师和师资博后,2021-11-18,329,1
清华大学材料课题组招聘热电/热障/结构陶瓷博士后,2021-11-18,316,1
重磅来袭，百万揽才！巢湖学院高层次人才引进公告,2021-11-18,350,1
滁州学院2021年度高层次人才引进公告,2021-11-18,348,1
杭州谱育科技发展有限公司-开发类岗位,2021-11-18,346,1
中国联合航空有限公司,2021-11-18,408,1
启明信息技术股份有限公司2022年校园招聘简章,2021-11-18,345,1
新乡医学院2021年诚聘海内外高层次人才,2021-11-18,345,1
凯里学院2021年高层次人才引进实施方案,2021-11-18,344,1
重庆海联职业技术学院2021年高层次人才引进,2021-11-18,322,1
九江学院2022年高层次人才招聘  ,2021-11-18,318,1
中国电器科学研究院股份有限公司,2021-11-18,320,1
重庆文理学院面向海内外公开招聘二级学院院长公告,2021-11-18,312,1
肇庆学院2021年人才招聘启事,2021-11-17,339,1
高层次人才网第十二届博士专场网络视频双选会,2021-11-17,345,1
北京航空航天大学云南创新研究院,2021-11-17,362,1
远东控股集团有限公司,2021-11-17,367,1
北京市顺义区第五期“梧桐工程—干部人才引进计划”暨2022年公务员、事业编公开招考,2021-11-17,366,1
龙盈智达（北京）科技有限公司,2021-11-17,381,1
锐方（上海）私募基金管理有限公司,2021-11-17,361,1
江西应用科技学院2021年人才招聘,2021-11-17,349,1
上海烟草机械有限责任公司高层次人才招聘简章,2021-11-17,361,1
广东医科大学项目制聘用人员招聘,2021-11-17,334,1
北京市正泽学校2021年教师招聘公告,2021-11-17,374,1
安徽机电职业技术学院2021年度高层次人才招聘,2021-11-17,354,1
香港科技大学工学院理学硕士（MSc）综合场线上招生宣讲会,2021-11-17,325,1
天正地产集团有限公司,2021-11-17,281,1
中国电建集团青海省电力设计院有限公司,2021-11-17,286,1
国网通用航空有限公司,2021-11-16,365,1
南京理工大学新能源学院教师招聘,2021-11-16,318,1
江苏医药职业学院2021年拟公开招聘计划,2021-11-16,317,1
中铁投资集团有限公司,2021-11-16,427,1
厦门工学院2021-2022年教师招聘启事,2021-11-16,307,1
嘉应学院2021-2022年人才招聘启事,2021-11-16,310,1
浙江大学王绪化团队招聘博士后和科研助理,2021-11-16,304,1
中国科学院长春应用化学研究所,2021-11-16,312,1
东北农业大学2021年下半年人才公开招聘公告,2021-11-16,309,1
南京工业大学电控学院分论坛诚邀海内外英才参加,2021-11-16,310,1
牧原食品股份有限公司,2021-11-16,318,1
牧原食品股份有限公司,2021-11-16,306,1
中国船舶工业系统工程研究院,2021-11-16,402,1
深圳九算优化科技有限公司,2021-11-16,321,1
红谷集群科技有限公司,2021-11-16,350,1
红谷集群科技有限公司,2021-11-16,326,1
北京胜信网络科技有限公司,2021-11-16,326,1
宁波财经学院2021-2022学年高层次人才招聘,2021-11-16,283,1
商业航天明星企业【零壹空间】空中宣讲来啦！！,2021-11-16,294,1
辽宁工程技术大学引进层次和待遇,2021-11-16,300,1
鹏华基金管理有限公司,2021-11-16,309,1
厦门美赫电子有限公司,2021-11-16,317,1
梦想启航 “职”通未来-内蒙古大学2021-2022年高薪诚聘海内外人才,2021-11-16,321,1
广聚英才 共谋发展 南京工业职业技术大学2021年下半年海内外优秀人才招聘公告,2021-11-16,320,1
衢州学院2021年下半年高层次人才招聘公告,2021-11-15,308,1
玉溪师范学院2021年常年招聘博士公告,2021-11-15,316,1
中电国营第七二二厂秋季招聘公告,2021-11-15,349,1
中国联通四川省分公司2021年（2022届） 秋季校园招聘公告（第三批）,2021-11-15,346,1
筑巢引才 振兴三晋-晋中学院2021年人才引进公告,2021-11-15,321,1
新拓尼克（北京）科技研发中心有限公司,2021-11-15,335,1
中车株洲电力机车研究所有限公司 2022届校园招聘公告,2021-11-15,317,1
商丘师范学院2021年诚聘博士等优秀人才,2021-11-15,331,1
河北工大科雅能源科技股份有限公司,2021-11-15,347,1
安徽理工大学全职博士后招收,2021-11-15,348,1
重庆市交通高级技工学校招聘1名心理健康教育管理岗,2021-11-15,508,1
电子工业出版社有限公司,2021-11-15,321,1
山东电力设备有限公司,2021-11-15,305,1
攀枝花学院2021年高层次人才招聘简章,2021-11-14,302,1
新疆财经大学2021年高层次人才招聘启事,2021-11-12,294,1
山东畜牧兽医职业学院2021年公开招聘副高级岗位人员和博士研究生简章,2021-11-12,295,1
东软集团,2021-11-12,319,1
邯郸制药股份有限公司,2021-11-12,316,1
西比爱斯汽车技术（上海）有限公司,2021-11-12,318,1
安徽理工大学2021年博士招聘,2021-11-12,313,1
嘉实基金2022校园招聘,2021-11-12,322,1
宁波工程学院博士后创新实践基地博士后招聘简章,2021-11-12,304,1
中资网络信息安全科技有限公司2022校招持续中【地点：北京】,2021-11-12,357,1
鞍山师范学院引进博士人才相关待遇,2021-11-11,303,1
广州软件学院2021年招聘启事,2021-11-11,306,1
毫末智行科技有限公司,2021-11-11,376,1
南京理工大学网络空间安全学院教师招聘,2021-11-11,315,1
【甘肃国企】金川集团面向北京邮电大学秋季招聘信息,2021-11-11,262,1
荷兰帕沃英蒂格盛有限公司深圳代表处,2021-11-11,338,1
广东省特种设备检测研究院珠海检测院2022年招聘公告,2021-11-11,308,1
清华大学张晨团队2021年诚聘数据科学方向优秀博士后和科研助理,2021-11-11,329,1
深圳雅学科技有限公司2021年下半年招聘,2021-11-11,298,1
广州南沙2021年“寻访揽才高校行”活动,2021-11-11,318,1
北京佐佑管理顾问有限公司,2021-11-11,304,1
浙江中控技术股份有限公司,2021-11-11,298,1
光大科技有限公司秋季招聘,2021-11-10,354,1
宿迁学院2021年高层次人才招聘公告,2021-11-10,323,1
北京月生信息技术有限公司,2021-11-10,338,1
浙江工业职业浙江工业职业技术学院公开招聘高层次人才公告,2021-11-10,328,1
潮州三环（集团）股份有限公司,2021-11-10,331,1
国寿股权公司明星被投企业联合校招,2021-11-10,330,1
贵州航天计量测试技术研究所2022届秋季校园招聘,2021-11-10,331,1
北京龙双利达知识产权代理有限公司,2021-11-10,260,1
北京龙双利达知识产权代理有限公司,2021-11-10,260,1
北京龙双利达知识产权代理有限公司,2021-11-10,266,1
长城物业集团股份有限公司北京物业管理分公司,2021-11-10,320,1
上海视觉艺术学院2021-2022年度招聘启事,2021-11-10,297,1
先临三维科技股份有限公司2022校园招聘,2021-11-10,292,1
西华大学2021年人才招聘公告,2021-11-10,311,1
先临三维科技股份有限公司2022校园招聘,2021-11-10,309,1
宁波工程学院向海内外诚聘特聘教授，学科带头人 ,2021-11-10,290,1
中国科学院海西研究院厦门稀土材料研究中心2021-2022年科研人才招聘启事,2021-11-10,292,1
武汉商贸职业学院2021年招聘公告,2021-11-10,308,1
南孔圣地-衢州有礼-事业编制-衢州学院2021年下半年人才招聘公告-评聘高级职称名额充足-解决子女入学,2021-11-10,299,1
深圳小库科技有限公司,2021-11-10,312,1
深圳小库科技有限公司,2021-11-10,310,1
深圳小库科技有限公司,2021-11-10,333,1
深圳小库科技有限公司,2021-11-10,307,1
深圳小库科技有限公司,2021-11-10,311,1
深圳小库科技有限公司,2021-11-10,310,1
浙江越秀外国语学院2021年高层次人才引进公告,2021-11-09,296,1
第十二届高层次人才网秋冬季博士专场网络视频双选会,2021-11-09,365,1
深圳大学智能物联网中心杨亚涛特聘教授团队2021年博士后招聘公告,2021-11-09,385,1
政府咨询项目助理,2021-11-09,413,1
商业火箭技术公司【零壹空间】邀您来撩！,2021-11-09,382,1
江西水利职业学院2021年博士招聘,2021-11-09,349,1
重庆能源职业学院2021年招聘简章,2021-11-09,333,1
奋斗百年路 启航新征程-山东理工大学2021年诚聘海内外高层次人才,2021-11-09,338,1
中国联通哈尔滨软件研究院,2021-11-09,356,1
水利部长江水利委员会长江科学院2022年度校园招聘(博士岗位)公告,2021-11-08,308,1
上海视觉艺术学院2021-2022学年招聘启事,2021-11-08,291,1
北京塔基资产管理有限公司,2021-11-08,376,1
2022中公教育校园招聘-公考讲师,2021-11-08,359,1
阳光人寿保险股份有限公司,2021-11-08,355,1
常州机电职业技术学院2021年公开招聘工作人员（第一批）,2021-11-08,293,1
铁力山（北京）控制技术有限公司,2021-11-08,384,1
荆楚理工学院2021年博士研究生招聘,2021-11-08,298,1
江西软件职业技术大学2021年行政管理及辅导员招聘公告 ,2021-11-08,299,1
江西软件职业技术大学2021年专任教师招聘公告,2021-11-08,304,1
长治学院2021年公开招聘博士研究生公告,2021-11-08,300,1
以工报国 未来可期-厦门工学院2021年博士人才引进计划,2021-11-08,301,1
中信证券股份有限公司北京分公司校招管培生,2021-11-08,363,1
北京华宇信息技术有限公司博士后招聘&培养公告  ,2021-11-08,391,1
南京工业大学-电控学院分论坛诚邀海内外英才参加,2021-11-08,300,1
海南热带海洋学院2021年度考核招聘教学科研人员公告,2021-11-08,309,1
西南医科大学2021年诚聘海内外英才,2021-11-07,273,1
东北农业大学2021年下半年人才公开招聘公告,2021-11-07,287,1
岭南现代农业科学与技术广东省实验室高端人才、拔尖人才招聘公告,2021-11-07,289,1
厦门工学院2021-2022学年高层次人才（博士）引进计划,2021-11-07,284,1
南亚热带作物研究所湛江站实验站2021年第六批博士研究生人员公开招聘公告,2021-11-07,282,1
中国科学院微电子研究所低功耗智能芯片与系统团队招聘,2021-11-07,387,1
中科南京智能技术研究院招聘简章,2021-11-07,372,1
材料科学姑苏实验室博士后招聘公告,2021-11-07,286,1
江苏科技大学2021年诚聘海内外优秀人才,2021-11-07,290,1
星际防务2022年校园招聘,2021-11-06,416,1
加入我们！“船”承理想 强军报国-中国船舶第八研究院（南京）2022届校园招聘,2021-11-06,311,1
广州金升阳科技有限公司2022&2023届秋季校园招聘,2021-11-06,300,1
重庆城市科技学院2021学年招聘简章,2021-11-05,352,1
大连理工大学高等教育研究院人才招聘,2021-11-05,352,1
湖南拓维信息系统股份有限公司,2021-11-05,371,1
重庆零壹空间科技集团有限公司,2021-11-05,364,1
广东机电职业技术学院、广东省博士工作站2021年博士研究生招聘公告,2021-11-05,343,1
闽南师范大学2021年招聘公告,2021-11-05,349,1
2021年南京工业大学高层次人才招聘,2021-11-05,377,1
南京工业大学马克思主义学院诚聘高层次人才,2021-11-05,340,1
清华大学材料课题组招聘热电/热障/结构陶瓷博士后,2021-11-05,321,1
福建工程学院马克思主义学院教学科研人员招聘启事,2021-11-05,335,1
江苏科技大学2021年诚聘海内外优秀人才,2021-11-05,354,1
2022年国防科大电子科学学院公开招聘军队文职、博士后,2021-11-05,418,1
桂林信息科技学院（原桂林电子科技大学信息科技学院）2021年专任教师招聘公告,2021-11-05,351,1
中山大学微电子科学与技术学院2021年人才招聘公告,2021-11-05,410,1
清华大学出版社有限公司,2021-11-05,442,1
中山大学生物医学工程学院2021年诚聘英才,2021-11-05,376,1
邯郸学院选聘博士研究生,2021-11-05,421,1
国寿股权投资有限公司,2021-11-05,357,1
安家费20万~45万！科研启动金30万~50万！湖北医药学院2021年秋冬季博士人才视频双选会,2021-11-05,293,1
东北农业大学2021年下半年人才公开招聘公告,2021-11-04,336,1
西安工业大学新能源科学与技术研究院2021招聘简章,2021-11-04,332,1
中国科学院微电子研究所低功耗智能芯片与系统团队招聘,2021-11-04,362,1
重庆邮电大学2021-2022年招聘启事,2021-11-04,375,1
中科南京智能技术研究院招聘简章,2021-11-04,380,1
中国重型汽车集团有限公司,2021-11-04,377,1
南开大学化学学院陈军院士团队招收博士后和研发工程师,2021-11-04,349,1
上海司南卫星导航技术股份有限公司,2021-11-04,368,1
宁波安贤投资管理有限公司,2021-11-04,375,1
宁波安贤投资管理有限公司,2021-11-04,370,1
巢湖学院引进博士人才公告,2021-11-04,344,1
亳州学院2021年高层次人才招聘,2021-11-04,363,1
蘑菇车联2022校园招聘,2021-11-04,382,1
医世界 渡未来——2022医渡科技校园招聘正式启动,2021-11-04,367,1
中国科学院计算技术研究所2021年秋冬季博士人才视频双选会,2021-11-04,397,1
福州外语外贸学院2021年秋冬季博士人才视频双选会,2021-11-04,341,1
数码视讯科技集团2022届校园招聘,2021-11-03,360,1
石河子大学政法学院2022年人才招聘,2021-11-03,330,1
南宁职业技术学院公开招聘博士研究生公告,2021-11-03,324,1
铸魂育人 职等你来-2021常州大学诚邀海内外人才共谋发展,2021-11-03,335,1
溪牛投资管理（北京）有限公司,2021-11-03,341,1
北京市经济与社会发展研究所,2021-11-03,391,1
赛迪顾问股份有限公司2022年秋季招聘,2021-11-03,357,1
深圳市赛元微电子有限公司,2021-11-03,336,1
深圳市赛元微电子有限公司,2021-11-03,363,1
嘉庚创新实验室2021年博士后招聘公告,2021-11-03,351,1
来浙，必有我师-浙江师范大学2021年专任教师招聘公告,2021-11-03,353,1
“让出行更美妙” 一汽出行科技有限公司2022全球校园招聘,2021-11-03,340,1
最高待遇120万，有编制，福利好！湖北汽车工业学院2021年秋冬季博士人才视频双选会,2021-11-03,391,1
珠海格力电器股份有限公司,2021-11-03,378,1
南昌工学院2021年高层次人才招聘启事,2021-11-03,344,1
上海浦劢实业有限公司招聘计划,2021-11-03,345,1
浙江财经大学东方学院2021年专任教师招聘简章,2021-11-03,335,1
年薪28万起！中国科学院工程热物理研究所2021年秋冬季博士人才视频双选会,2021-11-03,347,1
猎聘2022秋季校园招聘,2021-11-03,357,1
潍坊医学院2021年诚聘海内外优秀博士,2021-11-02,311,1
不负韶华 共筑梦想-枣庄学院2021年人才招聘启事,2021-11-02,337,1
2022中公教育校园招聘-教招讲师,2021-11-02,352,1
河北农业大学2021年选聘博士公告,2021-11-02,326,1
中科南京智能技术研究院招聘简章,2021-11-02,362,1
中国人民银行数字货币研究所,2021-11-02,482,1
2022天阳科技校园招聘 锐阳计划 招聘简章,2021-11-02,347,1
小米集团2022全球校园招聘-急招职位,2021-11-02,453,1
浙江新课堂教育股份有限公司,2021-11-02,330,1
北京未磁科技有限公司,2021-11-02,349,1
西安交通大学城市学院骨干人才招聘,2021-11-02,343,1
锐方（上海）私募基金管理有限公司,2021-11-02,307,1
2022年度赴港攻读硕士,2021-11-01,400,1
水利部长江水利委员会长江科学院2022年度校园招聘(博士岗位)公告,2021-11-01,324,1
迈威迩电子科技（上海）有限公司,2021-11-01,328,1
必创科技2022秋季校园招聘,2021-11-01,344,1
第一创业证券2022届校园招聘,2021-11-01,334,1
泰康保险集团股份有限公司,2021-11-01,337,1
IT 二线应用支持,2021-11-01,347,1
江西服装学院2021年下半年招聘启事,2021-11-01,326,1
嘉兴学院2021年度人才引进招聘公告,2021-11-01,321,1
北京零点有数数据科技股份有限公司,2021-11-01,376,1
姿美堂2022招聘简章,2021-11-01,287,1
香港科技大学22fall数据建模硕士学位项目线下招生宣讲会,2021-10-31,330,1
逐梦一流 看浙里-宁波大学2021-2022年度公开招聘人才公告,2021-10-31,329,1
厦门工学院2021年教师招聘启事,2021-10-31,326,1
河北农业大学2021年选聘博士公告,2021-10-31,321,1
深圳综合粒子设施研究院校园招聘公告,2021-10-31,321,1
九江学院2021年高层次人才招聘公告,2021-10-31,321,1
台州学院高等研究院大数据智能医疗研究所2021-2022年招聘启事,2021-10-31,318,1
福建工程学院2022年师资招聘计划,2021-10-31,317,1
南京信息工程大学高端光电仪器及激光技术团队诚招青年教师和师资博后,2021-10-31,314,1
 广东机电职业技术学院、广东省博士工作站2021年博士研究生招聘公告,2021-10-31,325,1
深圳市钛锋智能有限公司2022届校园招聘,2021-10-31,337,1
湘潭大学2021年博士后招聘简章,2021-10-29,340,1
南亚热带作物研究所湛江站实验站2021年第六批博士研究生人员公开招聘公告,2021-10-29,332,1
九江学院2021年高层次人才招聘公告,2021-10-29,347,1
山东省科学院海洋仪器仪表研究所2021-2022年招聘,2021-10-29,351,1
嘉应学院2021-2022年人才招聘启事,2021-10-29,336,1
重庆邮电大学2021-2022年招聘启事,2021-10-29,387,1
深圳综合粒子设施研究院校园招聘公告,2021-10-29,340,1
电装智能科技（上海）有限公司西安分公司,2021-10-29,356,1
天津南大通用数据技术股份有限公司,2021-10-29,373,1
清华大学出版社2022校园招聘,2021-10-29,408,1
天津南大通用数据技术股份有限公司,2021-10-29,353,1
宿迁学院2021年高层次人才招聘,2021-10-29,377,1
重磅来袭 百万揽才 巢湖学院引进博士人才（2021年10月份更新）,2021-10-29,373,1
战略支援部队信息工程大学洛阳校区2022年文职人员招聘、博士后招收简章,2021-10-29,367,1
 岭南现代农业科学与技术广东省实验室高端人才、拔尖人才招聘公告,2021-10-28,346,1
中科南京智能技术研究院招聘简章,2021-10-28,365,1
厦门大学嘉庚学院2021-2022学年专任教师招聘启事,2021-10-28,353,1
湖州师范学院量子物理研究中心高层次人才招聘启事,2021-10-28,324,1
南通大学电气工程学院2021年诚聘海内外英才,2021-10-28,346,1
首都师范大学2021年博士后科研人员招收公告,2021-10-28,368,1
中国科学院国家空间科学中心2022年应届生招聘启事,2021-10-28,389,1
北京雄恩数学培训学校2022年校园招聘,2021-10-28,352,1
沃特世科技（上海）有限公司,2021-10-28,377,1
太初（无锡）电子科技有限公司2022校园招聘,2021-10-28,370,1
北京轻舟智航智能技术有限公司,2021-10-28,364,1
应急管理部上海消防研究所 2022年招聘,2021-10-28,394,1
引才正当时 共筑西华梦-西华大学2021年人才招聘公告,2021-10-28,347,1
北京多彩互动广告有限公司,2021-10-28,363,1
国金基金2022校园招聘,2021-10-28,402,1
商业火箭技术公司【零壹空间】邀您来撩！,2021-10-28,371,1
携手师大 筑梦未来-江苏师范大学2021年人才引进政策及计划,2021-10-28,373,1
广东科技学院公开招聘工作人员,2021-10-28,347,1
北京未尔锐创科技有限公司2022届校园招聘,2021-10-28,313,1
遇“鉴”得物，预见未来！得物App2022校园招聘,2021-10-28,307,1
乐道济世 砥砺前行-潍坊医学院2021年诚聘海内外优秀博士,2021-10-28,401,1
桂林电子科技大学2021年高层次人才招聘公告,2021-10-27,343,1
山东省科学院激光研究所2021年人才招聘简章,2021-10-27,356,1
北京万科经纪房地产有限公司,2021-10-27,389,1
重庆城市科技学院2021-2022学年秋招聘简章,2021-10-27,353,1
山东工程职业技术大学2021年商河校区招聘,2021-10-27,373,1
荆楚理工学院2021年博士研究生招聘,2021-10-27,343,1
中山大学数学学院（珠海）诚聘海内外英才！,2021-10-27,347,1
