title,date,views
思谋科技（B轮独角兽）2022届校园招聘,2021-10-13,230
接过你的行囊，成就你的梦想|万联证券2022年校园招聘全面启动,2021-10-12,194
浙江上风高科专风实业股份有限公司2022届校园招聘,2021-10-12,192
苏州苏高新集团有限公司,2021-10-14,183
专利审查协作江苏中心&河南中心  2022年专利审查员招聘启事,2021-10-15,241
山东省港口集团有限公司2022年应届大学毕业生招聘简章,2021-10-18,225
电装集团2022校园招聘,2021-10-14,235
华润万象生活2022届“万象生”校园招聘,2021-10-13,221
一起峰，盈未来丨盈峰环境2022届校园招聘,2021-10-12,177
中电科网络空间安全研究院有限公司,2021-10-13,306
西人马-专注高端芯片-2022校招简章,2021-10-14,320
福建海创光电有限公司2022届应届生招聘简章,2021-10-18,216
中信重工机械股份有限公司,2021-10-19,224
中国电建集团青海省电力设计院有限公司2022校园招聘,2021-10-15,239
大家保险集团2022集中校园招聘正式启动,2021-10-15,228
“才聚中信、筑梦消金”—中信消金诚邀英才,2021-10-18,204
中国人寿保险股份有限公司陕西省分公司2022年度校园招聘启事,2021-10-12,192
上海申铁信息工程有限公司,2021-10-14,189
鼎铉公司2022秋季校园招聘火热来袭！,2021-10-14,184
芯驰神往，锂动未来——天津力神电池2022届全球校园招聘,2021-10-18,202
南方基金管理股份有限公司,2021-10-14,190
北京忆芯科技有限公司,2021-10-13,250
重庆长安民生物流股份有限公司2022校园招聘简章,2021-10-14,201
成谷科技2022届校园招聘,2021-10-12,263
必创科技2022秋季校园招聘,2021-10-15,348
腾讯子公司——杭州聆曦网络科技有限公司(杭州藤木网络科技有限公司更名）2022届校园招聘,2021-10-13,325
苏州高新区2021年度专业化青年人才定岗特选简章,2021-10-15,261
广州工商学院2021年博士毕业教师招聘启事,2021-10-12,168
双休高薪！广州速游网络科技有限公司2022届校园招聘,2021-10-18,213
上海璞泰来新能源科技股份有限公司2022届校园宣讲招聘会,2021-10-15,190
粤港澳大湾区重要节点城市——惠州学院2021年招聘专任教师（博士、硕士）,2021-10-18,199
梦耀南湖 创想未来丨南湖实验室2022秋季校园招聘正式启动！,2021-10-14,195
合力泰科技股份有限公司招聘简章,2021-10-14,212
中国能源建设集团广西电力设计研究院有限公司2022届毕业生校园招聘简章,2021-10-18,217
江苏金融租赁股份有限公司  2022年度校园招聘简­­章----空中宣讲会,2021-10-15,226
中国电波传播研究所（中国电子科技集团公司第二十二研究所）招聘,2021-10-12,414
星融元数据技术有限公司2022校园招聘,2021-10-13,227
合肥水泥研究设计院有限公司 2022年度高校毕业生招聘简章,2021-10-19,217
海尔智家 2022GEDP全球研发工程师发展项目（10.19宣讲会）,2021-10-15,230
“联华新青年，智创新未来”  杭州联华华商集团校园招聘,2021-10-14,187
山东临工工程机械有限公司,2021-10-16,171
广东纳睿雷达科技股份有限公司,2021-10-14,182
安徽华米信息科技有限公司,2021-10-14,182
T3出行2022届校园招聘公告,2021-10-14,289
中国电建集团青海省电力设计院有限公司,2021-10-12,187
数码视讯科技集团2022届校园招聘-西安专场（时间10月18日-10月19日）,2021-10-13,252
微医2022校园招聘,2021-10-18,231
德阳市人力资源服务中心,2021-10-13,217
南京木木西里科技有限公司“年青有为”2022校园招聘,2021-10-14,183
山东泰开电力电子有限公司招聘简章（新能源电力电子装备领先企业）,2021-10-14,188
浙江省交投控股集团有限公司2022届校园招聘,2021-10-17,189
商业火箭技术公司【零壹空间】邀您来撩！,2021-10-12,234
”芯怀家国，正青春“龙芯中科2022校园招聘,2021-10-19,274
深圳市理邦精密仪器股份有限公司,2021-10-19,213
浙江华是科技股份有限公司-2022年校园招聘,2021-10-13,223
四川省泸州市事业单位正编岗位及部分企业招聘,2021-10-12,247
麒盛科技股份有限公司2022届研发技术岗校园招聘（10月20日宣讲）,2021-10-18,222
世界500强泰康人寿山东分公司2022年校园招聘(非销售）,2021-10-19,168
贵州省邮电规划设计院有限公司,2021-10-14,207
在理想的地方遇见更好的你  ——理想汽车2022届校园招聘简章,2021-10-14,266
东风日产2022年秋季校园招聘简章,2021-10-17,198
“心游戏，源于你” 心源互动2022届秋季校园招聘,2021-10-12,223
东方晶源微电子科技（北京）有限公司2022届校园招聘,2021-10-19,277
长园高能2021-2022年校园招聘简章,2021-10-14,214
慧荣科技（深圳）有限公司  招聘简章,2021-10-13,224
深圳市赛维时代科技股份有限公司2022校招,2021-10-14,214
纸贵科技2022届校园招聘简章,2021-10-13,238
中国邮政集团有限公司福建省分公司2022校园招聘公告,2021-10-19,194
平安银行股份有限公司苏州分行校园招聘,2021-10-12,201
长江证券信息技术校招专场交流会来啦！,2021-10-17,180
中国平安财产保险股份有限公司广东分公司2022届校园招聘（橙星管培生）,2021-10-18,343
陕西航天动力高科技股份有限公司2022年应届生招聘,2021-10-19,702
太初（无锡）电子科技有限公司2022校园招聘（无锡、北京）,2021-10-13,255
北京知本创业管理咨询有限公司,2021-10-14,192
山东华辰泰尔信息科技股份有限公司,2021-10-15,225
TATA木门2022校园招聘简章,2021-10-14,174
南京中新赛克2022届校园招聘,2021-10-12,189
博士专场招聘，Offer速度派发！10月29日和11月19日视频“云”招聘等你来参加！,2021-10-19,231
三花控股集团2022“扬帆计划”管培生招聘简章,2021-10-17,195
循环不息  为Li而生——邦普循环2022届邦普星校招计划,2021-10-14,184
用“芯”点  亮  未  来  ----英诺赛科2022届校园招聘简章,2021-10-14,249
思科系统（中国）博士生招聘,2021-10-13,209
北京宏动科技有限公司,2021-10-15,247
杭州长川科技股份有限公司2022届校园招聘,2021-10-17,221
“优青春，特自信”优特科技2022届校园招聘简章,2021-10-18,227
上海高性能集成电路设计中心,2021-10-19,266
“校园招聘-名企专区”——前程无忧特办,2021-10-14,215
广州杰赛科技股份有限公司2022届校园招聘,2021-10-13,215
浦发银行长沙分行2022年度校园招聘启事,2021-10-12,190
重庆真测科技股份有限公司2022年秋季招聘,2021-10-13,197
深圳市铭濠科技有限公司,2021-10-15,263
东莞新能德(NVT)2022届全球校园招聘,2021-10-18,221
中国人寿集团2022年度  校园招聘启事,2021-10-17,187
风润智能研究院2022年校园招募计划,2021-10-19,230
山东土地集团校园招聘简章,2021-10-14,202
北京中体骏彩信息技术有限公司2022届校园招聘,2021-10-14,215
中国出口信用保险公司2022年校园招聘公告,2021-10-14,300
衢州职业技术学院2021年人才引进公告（专业带头人、博士研究生）,2021-10-19,219
中国兵器装备集团兵器装备研究所,2021-10-13,431
宁波均胜智能汽车技术研究院有限公司招聘简章,2021-10-17,226
棒谷●2022校园招聘,2021-10-14,191
【国产崛起 绎起不凡】FONE2022届校招,2021-10-14,240
招募广东中强（CTX）2022届校园大使--西安电子科技大学,2021-10-18,191
北京米波通信技术有限公司招聘公告,2021-10-13,239
“精兵强将  大显身手 ” -广东中强（CTX）2022届校园招聘会,2021-10-14,209
郑州航空港兴港投资集团有限公司2022届校园招聘公告,2021-10-13,228
中国联通山东省分公司2022校园招聘公告,2021-10-14,182
九号公司2022校园招聘简章,2021-10-17,240
西安天宇星控信息科技有限公司,2021-10-19,291
2022陕西法士特松正“寻找闪闪发光的你”！,2021-10-13,310
泸州老窖集团有限责任公司  2022校园招聘简章,2021-10-15,251
中外运创科2022年校园招聘火热进行中~,2021-10-18,343
广东电网有限责任公司2022年校园招聘公告,2021-10-17,204
厦门美图之家科技有限公司,2021-10-19,200
中国铁塔2022年度校园招聘,2021-10-14,265
方寸微电子2022校园招聘,2021-10-14,242
松下集团2022届校园招聘全面启动,2021-10-14,302
浙江物产环保能源股份有限公司,2021-10-19,175
江苏希西维轴承有限公司校园招聘（本科9-12K 研究生12-15k）,2021-10-12,171
杭州沃镭智能2022届校园招聘简章,2021-10-12,207
佛吉亚中国2022届校园招聘,2021-10-11,261
 芯瞳半导体2022届校园招聘，10月12日与你相约北校区西大楼404,2021-10-09,269
山东泰开电力电子有限公司,2021-10-11,196
青岛鼎信通讯股份有限公司22届秋季招聘需求,2021-10-12,227
提前谋划   精准服务  朝阳区2021年高校毕业生秋季招聘活动正式启动,2021-10-12,161
青矩技术股份有限公司2022校招简章,2021-10-09,175
浙江省城乡规划设计研究院2022届校园招聘（电气、自动化专业）,2021-10-11,205
成都易我科技开发有限责任公司校园招聘简章（c++开发）,2021-10-11,239
东莞市天域半导体科技有限公司,2021-10-12,204
广发银行股份有限公司西安分行2022年度校园招聘公告,2021-10-11,236
佛吉亚中国2022届校园招聘,2021-10-09,230
中国科学院武汉岩土力学研究所,2021-10-09,178
北京安博通科技股份有限公司招生简章,2021-10-12,209
大连银行2022届校园招聘公告,2021-10-10,172
新疆交通投资（集团）有限责任公司所属子（分）公司2021年面向高校公开招聘公告,2021-10-09,187
2021年秋季在陕知名高校毕业研究生双选会 （参会单位公告）,2021-10-12,311
【小友正气，电有引力】小电2022校园招聘线下宣讲会,2021-10-09,199
西南技术物理研究所2022年校园招聘,2021-10-12,259
TCL格创东智！工业互联网领军企业！西安站活动倒计时2天！！,2021-10-11,263
亚太卫星宽带通信(深圳)有限公司,2021-10-12,285
浙江高信2022届校园招聘,2021-10-12,220
深圳市中科蓝讯科技股份有限公司 2022秋季校园招聘简章,2021-10-11,215
陕西凌云电器集团有限公司,2021-10-09,398
上海中建城市发展投资有限公司2022届校园招聘,2021-10-12,185
心有光 耀未来——赛尔富电子2022届校园招聘,2021-10-12,217
TCL格创东智！工业互联网领军企业！西安，我们来啦！！,2021-10-09,205
乐生活，居无限 - 青春滚烫，理想上扬！| 乐居2022秋季校园招聘正式启动！,2021-10-09,177
平安建设集团有限公司2022届校园招聘简章,2021-10-11,199
长江养老2022校园招聘正式开启,2021-10-09,181
中国信息通信研究院2022届校园招聘,2021-10-11,339
成谷科技2022届校园招聘 ——邀请你和我们一起开启高速公路自动驾驶时代的元年,2021-10-09,203
承载重托  驱动未来——临工重机2022届校园招聘,2021-10-11,191
福建新大陆支付技术有限公司2022校园招聘简章,2021-10-09,157
达你所愿 共赴未来——达美盛 2022届校园招聘,2021-10-11,188
汇联易2022届秋季校园招聘,2021-10-11,239
湖南大唐先一科技有限公司,2021-10-11,186
高新兴科技集团股份有限公司,2021-10-11,216
泉州三安半导体科技有限公司,2021-10-11,231
 抢占先机，智取未来——2022慧策（北京掌上先机网络科技有限公司）校园招聘,2021-10-09,172
麒麟合盛网络技术股份有限公司,2021-10-11,217
日月光半导体（江苏）2022届校园招聘简章,2021-10-09,211
厦门水务集团有限公司,2021-10-11,197
“欣起点·奕起来”——欣奕华集团2022校园招聘简章,2021-10-09,208
中国联合网络通信集团有限公司,2021-10-09,225
【合肥】容知日新2022校园招聘 未来.由你预测,2021-10-11,208
我的时代担当--树根互联2022届“向阳生”校园招聘计划,2021-10-09,202
布雷博（中国）2022校园招聘,2021-10-08,168
蚂蚁集团2022届秋季校园招聘,2021-10-08,240
合肥悦芯半导体科技有限公司2022届秋季校园招聘简章,2021-10-08,222
楷知信息科技（上海）有限公司西安分公司,2021-10-09,212
上海航天八院802所2022届校园招聘,2021-10-07,441
湖北省交通投资集团有限公司2022年校园招聘公告,2021-10-08,205
大连豪森智源数据有限公司2021&2022届毕业生招聘,2021-10-07,191
上海派能科技2022校园招聘,2021-09-30,142
得物App 2022校园招聘,2021-09-30,405
优特科技2022届校园招聘,2021-09-30,302
“追寻无与伦比” 华硕电脑2022届秋季校园招聘,2021-09-30,313
华安证券2022届校园招聘,2021-10-08,181
宣讲会-“筑梦锐鹰，传感未来” ——锐鹰传感2022届校招简章,2021-10-07,195
北京掌上先机网络科技有限公司,2021-09-30,240
荣芯半导体（宁波）有限公司2022校园招聘简章,2021-10-07,206
Ultipa 2022校园招聘,2021-09-30,367
护航产业互联网，安全数字世界——亚信安全2022校园招聘,2021-10-09,177
中信银行郑州分行2022年校园招聘公告,2021-10-08,192
航天智信暨航天三院体系总体部2022届校园招聘,2021-10-08,369
浙江诺诺网络科技有限公司,2021-10-09,232
中国船舶第八研究院（扬州院区·原七二三所）2022校园招聘,2021-10-08,211
中国银行河南省分行2022年校园招聘公告,2021-10-08,197
中信银行2022年校园招聘公告,2021-10-08,189
杭州龙即信息技术有限公司,2021-09-30,160
公牛集团股份有限公司——2022校园招聘陕西站,2021-10-08,220
D5渲染器2022届校园招聘，有爱有米一起出发~,2021-09-30,149
百城千校万人 - 厦门企业2022届毕业生校园云端大招聘,2021-10-09,166
山东产研微电子技术研究院有限公司,2021-10-09,229
联咏电子科技（西安）有限公司2022届校招持续进行中（软件/算法）--双休,2021-10-11,309
民生科技有限公司2022届校园招聘计划,2021-10-09,234
西安卫光科技有限公司招聘简章,2021-10-11,380
2022施耐德电气秋季校园招聘正式启动！,2021-10-08,217
俊发集团2022届新俊杰校园招聘简章  ——为理想 行无止,2021-09-30,163
国开金融有限责任公司2022年高校毕业生招聘公告,2021-10-08,197
浙江巨磁智能技术有限公司 【长沙研发中心】招聘简章,2021-10-09,213
西井科技2022届校园招聘火热进行中,2021-10-08,207
万达集团2022校园招聘,2021-10-08,221
引领西望、见证梦想--西部证券2022届“鲲鹏计划”校园招聘正式启动,2021-10-09,191
中国建设银行宁波市分行2022年度校园招聘公告,2021-10-08,160
东方晶源微电子科技（北京）有限公司2022届校园招聘,2021-10-08,219
四川长虹网络科技有限责任公司,2021-10-11,225
国网山东省电力公司  2022年高校毕业生校园招聘公告,2021-10-09,262
中国船舶集团有限公司第八研究院（扬州·七二三研究所）2022届校园招聘,2021-09-30,185
“加入青矩，给自己更好的未来！”  青矩技术股份有限公司2022校招简章,2021-10-08,179
青海省农商银行（农信社）系统2022年度校园招聘公告,2021-10-08,162
中船重工杰瑞科技控股有限公司2022年招聘启动！,2021-10-03,256
烟台东方威思顿电气有限公司2022届校园招聘简章,2021-10-08,176
深圳市吉迩科技有限公司——赛道领跑、遇见未来,2021-10-09,195
国家开发银行新疆分行2022年高校毕业生招聘公告,2021-10-11,217
北京集佳知识产权代理有限公司西安分公司2022年校园招聘,2021-10-09,203
中国银行股份有限公司广西分行2022年校园招聘,2021-10-09,181
青岛乾程控股集团有限公司,2021-10-09,179
放手而为，成就精彩！英特尔成都2022校园招聘火热进行中！,2021-10-08,236
盛合晶微半导体（江阴）有限公司,2021-10-09,238
恒生银行（中国）2022校园招聘火热进行中,2021-10-08,213
西安华润置地发展有限公司,2021-10-03,196
中国移动销售分公司2022校园招聘,2021-10-08,173
浙江精功科技股份有限公司简章,2021-10-10,172
中信银行股份有限公司西安分行,2021-10-08,248
展现新生力量，探索没有边界！---交通银行广东省分行2022校园招聘火热启动,2021-10-09,192
九号公司2022校园招聘简章 ——“让起步更酷”,2021-10-08,181
江苏东成2022届校园招聘,2021-10-08,172
“智汇全球  才聚上饶”2021年引进高层次和急需紧缺人才专场活动（西北地区）即将启动！,2021-10-11,218
萧山互联网高科技人才校园云聘会,2021-10-10,164
苏州广播电视总台2022校园招聘简章,2021-10-08,178
数码视讯科技集团2022届校园招聘,2021-10-08,235
物产中大集团股份有限公司2022校园招聘,2021-10-04,167
北京交个朋友数码科技有限公司2022届秋季校园招聘简章,2021-10-09,222
EcoFlow正浩2022年秋季校园招聘 正因有你，未来更浩,2021-10-10,205
科技创造视界，视界成就梦想     超视界显示技术有限公司校园招聘正式开始,2021-10-09,205
广州白云国际机场股份有限公司,2021-10-08,236
【军工国企】中电国睿防务2022校园招聘全面启动！,2021-10-03,265
ASM先进科技驻香港科研中心 2022校园招聘,2021-10-08,214
汇聚国之栋梁 成就卓越人生  中国电子科技集团公司电子科学研究院2022届校园招聘启动,2021-10-11,261
­星宇股份2022校园招聘,2021-10-08,198
东风南方集团【央企】联友科技22届秋季校园招聘,2021-10-06,220
富迪科技（南京）有限公司2022届校园招聘,2021-10-08,180
惟客数据2022校园招聘招生简章,2021-10-08,172
中国移动通信集团山东有限公司,2021-10-08,206
新百丽鞋业（BELLE）2022届校园招聘,2021-10-08,189
纬创资通（重庆）有限公司,2021-10-12,169
北京金朋达航空科技有限公司,2021-10-06,177
中国铁塔安徽公司2022年校园招聘公告,2021-10-09,177
长沙银行2022全球校园招聘启事,2021-10-11,253
中电科29所四威高科2022校园招聘,2021-10-09,379
“碳”索未来 瑞力无限  南瑞集团有限公司2022届毕业生招聘简章,2021-10-10,228
北京计算机技术及应用研究所,2021-10-10,242
 【梅卡曼德机器人-2022校招简章】3D感知、视觉和机器人算法、机器人软件岗位校招+实习热烈开启,2021-10-06,186
重庆安道拓汽车部件系统有限公司,2021-10-08,177
ASM先进科技（中国）有限公司2022校园招聘,2021-10-08,253
长江证券2022届校园招聘简章,2021-10-10,197
 Siemens EDA 2022校园招聘,2021-10-08,184
希微科技2022校园招聘,2021-10-08,200
浙江精功科技股份有限公司,2021-10-06,166
中国联通上海市分公司2022届校园招聘,2021-10-08,188
2021年秋季全国研究生专场巡回招聘会暨国防军工类专场招聘会—西安站,2021-10-09,541
唯品会2022招聘公告,2021-10-08,197
西安华讯科技有限责任公司,2021-10-11,519
小龙坎控股集团校园招聘简章,2021-10-09,227
华太集团2022校园招聘简章,2021-10-09,255
2022年昆仑万维-蓝诺微银校园招聘,2021-10-08,194
北京首都国际机场股份有限公司2022届校园招聘,2021-10-10,205
北森云计算有限公司,2021-10-08,207
智享科技，芯创未来—智芯公司2022秋季校园招聘正式启动,2021-10-08,239
绵阳惠邻居民服务社会企业有限公司,2021-10-11,190
宝龙达集团2022校园招聘——正青春，造未来,2021-10-09,205
保利地产投资顾问有限公司2022校园招聘,2021-10-06,158
太平金科2022校园招聘简章,2021-10-10,207
苏州国芯科技股份有限公司2022校园招聘,2021-10-09,213
E路智领 为芯护航——2022届苏州珂晶达校园招聘简章,2021-10-08,188
“大数据，达梦想” 北京大数据先进技术研究院 2022届秋季校园招聘,2021-10-08,216
10月15日博士人才视频“云”招聘邀您参加,2021-10-06,211
深圳市联得自动化装备股份有限公司2022校园招聘,2021-10-08,182
正方集团公司2022届管培生  校园招聘简章,2021-10-08,199
中国南方电网有限责任公司超高压输电公司2022年校园菁英招聘,2021-10-09,303
远景动力2022应届生全球招聘进行中,2021-10-10,231
信梦想，期未来 | 中信期货2022校园招聘正式启动啦！,2021-10-11,246
福建农信科技部2022年度  校园招聘简章,2021-10-08,174
伊利集团酸奶事业部西北大区2022年校园招聘,2021-10-09,228
中信科移动2022校园招聘正式启动！,2021-10-09,315
“联通世界 沃领未来”  中国联通广东省分公司2022年秋季校园招聘正式启动！,2021-10-08,186
南京恒电电子有限公司2022届校园招聘【射频（微波）工程师、FPGA工程师、销售工程师、管培生】,2021-10-08,194
曹操出行2022届秋季校园招聘,2021-10-10,265
联咏电子科技（西安）有限公司2022届校招（软件/算法）--双休,2021-10-09,246
武汉天喻信息产业股份有限公司,2021-10-09,171
福建省邮电规划设计院有限公司,2021-10-09,205
中建八局装饰工程有限公司,2021-10-10,180
爱优卡（天津）汽车科技有限公司招募青年设计师，期待你的加入！,2021-10-11,207
昆山农村商业银行2022年度秋季校园招聘简章,2021-10-08,159
山推股份2022校园招聘,2021-10-09,196
北京亦庄投资控股有限公司2022校园招聘简章,2021-10-09,202
我们的芯片改变世界  ——安凯微电子2022届校园招聘,2021-10-09,253
声随心动，以梦为马——喜马拉雅2022校园招聘,2021-09-30,315
中信银行昆明分行2022年校园招聘公告,2021-09-30,256
上海鸣志电器股份有限公司,2021-09-29,165
山东高速集团有限公司2022校园招聘公告,2021-09-29,201
生来敢为，智者无畏丨金智教育2022届校园招聘,2021-09-30,218
江苏金陵科技集团有限公司  2022校园招聘简章,2021-09-29,187
天津三环乐喜新材料有限公司,2021-09-30,255
未来，等你设计——中国电建四川电力设计咨询公司2022届校园招聘,2021-09-28,164
天津银行2022年校园招聘启事,2021-09-29,184
浙江联通2022届校园招聘,2021-09-29,208
中国电建市政院2021-2022年度校园招聘公告,2021-09-29,267
国信证券股份有限公司博士后科研工作站 2022年招收博士后,2021-09-29,183
建筑湘军的排头兵——湖南建工集团有限公司,2021-09-28,146
北京安必奇生物2022届生物医药人才招募,2021-09-30,252
“筑梦锐鹰，传感未来” ——锐鹰传感2022届校招简章及宣讲会,2021-09-30,245
【景顺长城基金】2022校园招聘正式启动,2021-09-29,163
中信银行2022年校园招聘公告,2021-09-28,195
2022陕西法士特松正“寻找闪闪发光的你”！,2021-09-30,661
中国电子科技集团公司第四十一研究所2022校园招聘,2021-09-28,296
浙江泰隆商业银行股份有限公司2022届秋季校园招聘,2021-09-30,714
国网冀北电力有限公司,2021-09-29,256
欧姆龙（上海）有限公司2022校园招聘,2021-09-30,283
国行未来 为你而来！  厦门国际银行股份有限公司2022届校园招聘计划,2021-09-30,228
深高速2022校园招聘简章  开启高速 成长人生,2021-09-29,196
中海地产二〇二二『海之子招募计划』南京站招募公告,2021-09-30,250
旺宏微电子（苏州）有限公司校园招聘,2021-09-28,177
中国联通智网创新中心2022校园招聘,2021-09-30,332
汽车之家2022管培生计划,2021-09-28,190
中国石化大连石油化工研究院2022年校园招聘简章,2021-09-29,245
梦耀南湖 创想未来  南湖实验室2022校园招聘正式启动,2021-09-29,192
泰林生物2022“未来战士”校园招聘,2021-09-28,197
华泰证券2022校园招聘闪光登场！,2021-09-30,222
常州纵慧芯光半导体科技有限公司校园招聘,2021-09-28,202
联咏电子科技（西安）有限公司2022届校招（软件/算法）,2021-09-30,245
深圳市方为半导体有限公司招聘启事,2021-09-28,197
浙江无端科技股份有限公司2022届校园招聘,2021-09-30,185
奋战百亿乌江、广纳青年才俊  重庆市涪陵榨菜集团股份有限公司2021年秋季校园管培生招聘公告,2021-09-29,183
浙江巨磁智能技术有限公司【长沙研发中心】22届校园招聘,2021-09-30,192
招商银行海口分行2022届秋季校园招聘,2021-09-30,165
银联数据2022届校园招聘,2021-09-29,230
河南省交通规划设计研究院股份有限公司2022年校园招聘简章,2021-09-28,197
【世界500强】浙江物产环保能源股份有限公司 2022校园招聘简章,2021-09-29,224
让未来现在就来-因诺科技2022招聘简章,2021-09-28,206
中国光大银行广州分行2022年  秋季校园招聘启事,2021-09-29,170
广揽强国英才  共奔无限前程——江苏无线电厂有限公司2022届校园招聘,2021-09-28,153
 沸腾的年代 与你共启未来  博智林机器人2022届“科创先锋”校园招聘,2021-09-29,187
“晶”彩由你  “科”创未来-2022晶科电子校园招聘,2021-09-28,191
晟通集团“接班人”计划2022届校园招聘简章,2021-09-29,183
商业火箭技术公司【零壹空间】邀您来撩！,2021-09-28,208
烟台东方威思顿电气有限公司2022秋季校园招聘,2021-09-27,178
