title,date,views
山东百丞税务服务股份有限公司,2021-12-09,18
平安产险北分2022届全球校园招聘简章,2021-12-07,168
航天工程大学航天信息学院2022年招考文职人员岗位计划,2021-12-07,185
【佳能医疗】研发岗：AI算法/C++开发,2021-12-09,20
北京趣加科技有限公司技术类急招岗位,2021-12-02,232
权威发布！火箭军工程大学2022年面向社会公开招考文职人员岗位计划,2021-12-05,368
浙江省农信联社2022年校园招聘公告,2021-12-07,173
沈阳兴华航空电器有限责任公司2022届校园招聘,2021-12-07,167
国资委央企华录集团总部2022年校园招聘,2021-12-07,195
2021年沈阳市招才引智活动  西北地区重点高校大型网络招聘会,2021-12-04,325
2022届大学生招聘简章  宁波润禾高新材料科技股份有限公司,2021-12-07,161
多益网络2022届校园招聘补录,2021-12-06,349
关于2021年龙口市公开招聘高层次、急需紧缺青年人才第二轮招聘考点情况的公告,2021-12-04,324
在浙里 职面未来-浙江建设职业技术学院2021年人才招聘公告,2021-12-03,306
武警警官学院2022年文职人员招聘公告,2021-12-07,373
正大贸易（中国）有限公司,2021-12-09,26
广州鸿溪见杉科技有限公司,2021-12-07,321
 炬光科技2022校园招聘简章,2021-12-07,366
2021年冬季全国博士、硕士研究生巡回 签约洽谈会——西安站,2021-12-03,393
中国电子科技集团公司第四十一研究所2022校园招聘,2021-12-03,435
北京大豪科技股份有限公司,2021-12-08,147
中证股转科技有限公司2021年下半年招聘公告,2021-12-07,323
太原思特奇信息技术有限责任公司,2021-12-07,334
唱吧音乐集团2022校招补招，快来投简历吧！,2021-12-03,346
杭州涿溪脑与智能研究所,2021-12-08,149
商业航天明星企业【零壹空间】校招答疑会来啦！！,2021-12-06,332
康龙化成2022全国秋招补录  —化学、药学、化工与制药、生物、医学、材料专业,2021-12-06,375
在理想的地方遇见更好的你——理想汽车2022届校园招聘简章,2021-12-06,376
中信证券校招管培生-北京分公司,2021-12-02,233
西安中唐测控技术有限责任公司2022届人才招聘公告,2021-12-06,400
中联重科（工业互联网板块）2022届校园招聘简章,2021-12-06,379
舟创未来·智汇东海 海洋经济人才云聘会,2021-12-02,238
宜善医疗集团2022届校招,2021-12-06,348
海军航空大学2022年面向社会公开招考文职人员,2021-12-07,205
ASM先进科技2022秋招补录,2021-11-17,247
四川天府银行2022年校园招聘简章,2021-11-29,271
中国铁路物资集团有限公司2022校园招聘简章,2021-11-29,298
安通控股股份有限公司,2021-11-17,223
线上招聘：电信科学技术第十研究所有限公司,2021-12-02,304
湖北大学2022年专职辅导员、心理健康教育专职教师招聘,2021-11-17,225
计算机+核物理+金属材料“省属重点国企”山西云时代蓝点人才计划招聘简章,2021-11-26,230
日照银行2022届（秋季）校园招聘启事,2021-11-29,272
中国电科北京中网华通2022校园招聘开始啦,2021-11-15,267
安徽合力工业车辆进出口有限公司 2022届校园招聘,2021-11-12,231
烟台东方威思顿电气有限公司2022届校园招聘简章,2021-11-15,219
中国华电集团有限公司2022年“青年骏才”招聘和校园招聘公告,2021-11-12,370
深圳锐越微技术有限公司 2021年校园招聘简章,2021-11-12,262
中国建筑材料工业地质勘查中心山西总队2021年招聘简章,2021-11-25,211
2022年江苏省扬州市选聘优秀青年人才公告,2021-11-11,243
航天九院无人系统总体部2022届校园招聘,2021-11-25,312
加特兰微电子科技（上海）有限公司,2021-11-12,284
青岛乾程控股集团2022届校园招聘简章,2021-11-25,206
山西云时代技术有限公司 所属企业2022校园招聘公告,2021-11-26,224
国家计算机网络应急技术处理协调中心广西分中心 2022年度公开招聘公告,2021-11-16,238
大运汽车股份有限公司,2021-11-15,227
浙江捷昌线性驱动科技股份有限公司招聘简章,2021-11-12,236
宁波国君源泓投资管理有限公司,2021-11-25,219
北京阿丘机器人科技有限公司,2021-11-25,235
广州虹科电子科技有限公司2022校园招聘,2021-11-25,234
中建二局西南公司2022届校园招聘空中宣讲会（2021年11月16日18:00线上直播）,2021-11-12,237
【央企校招】中建城开公司2022届校招简章,2021-11-25,410
自然重塑你我 中粮成就梦想  ——中粮集团2022年校园招聘启动,2021-11-15,223
广西柳州钢铁集团有限公司,2021-11-16,221
陕西西咸新区环境集团有限公司,2021-11-19,350
上海电子信息职业技术学院2021年度招聘公告（第一批次）,2021-11-30,975
"大华股份-海外营销中心 2022届秋招末端招聘集结令,最快3天斩获offer",2021-11-26,254
爱旭股份2022届校园招聘——邀您一起拯救地球！,2021-11-22,227
邯郸制药股份有限公司2022届招聘简章,2021-11-16,219
南昌职业大学2021公开诚聘天下英才,2021-11-25,218
“蓉漂”城市组团引才行动——“蓉漂”金牛寻才地图  线上专场招聘会活动公告,2021-11-15,216
光大云缴费科技有限公司2022年秋季  校园招聘启事,2021-11-19,224
伊利集团液态奶事业部定州伊利2022年校园招聘,2021-11-22,213
重庆两江新区西北引才专场-千名硕博汇两江,2021-11-26,274
潮州三环（集团）股份有限公司,2021-11-12,260
TP-LINK 2022届秋招补录正式启动,2021-11-16,323
赓续百年初心 担当育人使命-大庆师范学院2021年下半年公开招聘教师公告,2021-11-30,961
广州广电运通金融电子股份有限公司,2021-11-26,225
上海爱数信息-助理研究员专场招聘,2021-12-02,228
无锡中微腾芯电子有限公司,2021-11-12,288
西安建筑科技大学2021年秋冬季博士人才现场招聘会,2021-11-29,303
重磅来袭！2022年海军潜艇学院人才引进公告,2021-12-07,195
青岛鼎信通讯股份有限公司22届秋季重点岗位补录,2021-12-01,975
燕京啤酒2022校园招聘,2021-11-15,216
盘星新型合金材料（常州）有限公司,2021-11-18,208
安康学院2021年秋冬季博士人才现场巡回招聘会,2021-11-26,191
佛山市国星光电股份有限公司2022校园招聘,2021-11-15,244
中科特思信息技术（深圳）有限公司,2021-11-22,241
云南红塔银行2021年新设机构及总行部分部门  人员招聘公告,2021-11-19,228
中国消防救援学院,2021-11-26,249
国家管网集团2022届高校毕业生 校园招聘宣讲会,2021-11-12,514
西安工商学院,2021-11-29,311
卡斯柯信号有限公司2022校园招聘简章-31人-北京,2021-11-16,230
西安市事业单位进校园公开招聘2022届高校毕业生公告,2021-12-01,1219
Kantar凯度2022届校园招聘正式开启,2021-11-18,233
北京中科泛华测控技术有限公司2022校园招聘简章,2021-11-19,245
中国专利代理（香港）有限公司2022年秋季公开招聘公告（可落户）,2021-11-28,189
【中图仪器】深圳市中图仪器股份有限公司2022届校园招聘,2021-11-15,11
晶方科技青年英才2022校园招募,2021-11-16,242
北京巴别时代科技股份有限公司  巴别时代2022校招,2021-11-26,218
淮阴师范学院,2021-11-29,272
惠州市星聚宇光学有限公司,2021-11-22,207
【成都站】高校人才网2021年秋冬季博士人才视频双选会邀请函,2021-12-02,250
牧原2022届应届生全球招聘,2021-12-08,191
北京天圣华信息技术有限责任公司  2021年招聘简章,2021-11-19,253
山东电力设备有限公司2022届高校毕业生招聘简章,2021-11-18,227
中航西安飞机工业集团股份有限公司,2021-11-12,345
重庆电力高等专科学校,2021-11-22,221
贝壳找房2022届校园招聘补录开启,2021-11-16,254
中国能源建设集团浙江火电建设有限公司,2021-11-15,237
深圳交易集团有限公司2022校园招聘,2021-11-12,227
全国中小企业股份转让系统有限责任公司 2021年下半年招聘公告,2021-12-01,996
世界500强泰康人寿山东分公司2022年校园招聘(非销售）,2021-12-08,159
香港科技大学数据建模硕士学位项目（MSc DDM） 12月宣讲会（线上+线下）通知,2021-11-28,197
深圳市视开智能科技有限责任公司招22年应届毕业生,2021-11-26,229
潍坊科技学院,2021-11-29,1021
苏州高新区2021年度专业化青年人才定岗特选  简章,2021-11-19,262
珠海许继电气有限公司2022年校园招聘&领航生计划,2021-11-18,233
慧策（北京掌上先机网络科技有限公司）2021秋季校园招聘最后冲刺,2021-11-29,232
潍柴2022年校园招聘扩招简章,2021-11-22,229
商业航天明星企业【零壹空间】空中宣讲来啦！！,2021-11-16,229
中国联通四川省分公司2021年（2022届）  秋季校园招聘公告（第三批）,2021-11-14,237
数码视讯科技集团2022届校园招聘,2021-12-01,1084
国网信通-深圳市国电科技通信有限公司22届校园招聘,2021-11-26,251
浙大宁波理工学院计算机与数据工程学院2021年招聘公告,2021-12-08,171
湖南北云科技有限公司,2021-11-15,230
国家计算机网络应急技术处理协调中心上海分中心2022年公开招聘公告,2021-11-18,270
天音通信有限公司,2021-11-29,997
中国电建集团山东电力建设有限公司,2021-12-01,227
青岛海尔生物医疗股份有限公司,2021-11-19,238
深爱人才 职等你来  2021年深圳面向全国高校应届毕业生  大型线上招聘活动简介,2021-11-14,226
中国东方航空股份有限公司西北分公司2022年校园招聘,2021-11-26,270
广聚英才 共谋发展 南京工业职业技术大学2021年下半年海内外优秀人才招聘公告,2021-11-16,212
西安葡萄城信息技术有限公司,2021-11-15,272
2021西安IT、电子、人工智能行业 急需紧缺人才网络招聘会,2021-11-23,487
商业航天明星企业【零壹空间】校招答疑会来啦！！,2021-11-29,993
2022年度中国对外贸易中心集团有限公司（广州）人才招聘,2021-11-29,240
华立集团股份有限公司2022年校园招聘,2021-11-18,247
爱旭股份2022届校园招聘——邀您一起拯救地球！,2021-12-01,210
国家计算机网络应急技术处理协调中心陕西分中心2022年度公开招聘公告,2021-11-19,260
航天物联网技术有限公司（航天773所）招聘简章,2021-11-23,292
青春不设限，此刻正当燃-车好多集团2022届校园招聘,2021-11-16,232
西安科技大学2021年秋冬季博士人才现场招聘会,2021-11-29,271
上汽通用汽车-新能源体验店销售类储备生招聘简章,2021-11-14,215
承德石油高等专科学校人才引进,2021-11-29,993
【高新技术国企】北京晨晶电子2022校招盛大启动,2021-12-08,141
深圳小库科技有限公司校招一览（北京&深圳））,2021-11-15,238
广物控股集团2022校园招聘,2021-12-01,209
华西地区重点高校大型网络招聘会,2021-11-26,214
山西大学2021年秋冬季博士人才现场招聘会,2021-11-29,243
国家计算机网络应急技术处理协调中心海南分中心2022年度公开招聘公告,2021-11-19,231
慧策（北京掌上先机网络科技有限公司）2021秋季校园招聘,2021-11-18,234
“豫见奋斗者”河南信息产业投资有限公司 2022年管理培训生招聘公告,2021-11-23,212
嘉贺恒德科技有限责任公司招聘光学工程师,2021-11-17,205
中国船舶第七一六研究所2022校园招聘,2021-11-15,353
引“杭”未来，“钢”好有你  ——杭钢集团2022届校园招聘,2021-11-14,226
中国科协所属单位2022年度公开招聘应届高校毕业生公告,2021-11-26,220
四川工商职业技术学院高层次人才引进公告,2021-11-18,225
重庆水利电力职业技术学院2021年公开招聘事业单位工作人员简章,2021-11-30,995
中汇会计师事务所寒假实习生招聘,2021-11-29,234
超星集团秋季校园招聘,2021-12-01,232
才聚鸢都·直通名校  2021年潍坊企业线上专场双选招聘会,2021-11-17,206
鼎道智联2022届校园招聘简章,2021-11-23,209
 香港科技大学工学院理学硕士环境工程学及管理(MSc EVEM)2022Fall宣讲会(线上),2021-11-21,191
陕西陕煤供应链管理有限公司2022届秋季校园招聘,2021-11-15,284
TCL华瑞照明科技（惠州）有限公司,2021-11-15,230
中国系统2022校园招聘冬季补招,2021-12-07,359
山东力山特智能科技股份有限公司,2021-11-26,267
重庆理工大学期刊社2021年招聘启事,2021-12-03,341
中国电子科技集团公司第五十三研究所2022届高层次人才招聘,2021-11-18,363
中国联合工程有限公司2022届校园招聘  大型央企筑梦平台,2021-11-30,993
香港科技大学工学院理学硕士土木基建工程及管理(MSc CIEM)2022Fall宣讲会(线上),2021-11-21,194
 成都中电锦江信息产业有限公司2022年校园招聘,2021-11-23,235
青春合伙，向上人生  中汇会计师事务所-2022汇梦生校园招聘,2021-11-29,226
西部超导材料科技股份有限公司秋招,2021-11-17,282
江苏御创科技有限公司介绍,2021-11-16,218
巨一科技2022届全球校园招聘,2021-11-15,247
中国科协所属单位2022年度公开招聘应届高校毕业生公告,2021-11-26,257
西安中唐测控技术有限责任公司2022届人才招聘公告,2021-12-09,61
鲜丰水果2022届“鲜行者”校园招聘简章,2021-11-30,986
中国贸促会专商所2022年度校园招聘,2021-12-01,203
重庆海联职业技术学院2021年高层次人才引进,2021-11-18,235
酒泉钢铁（集团）有限责任公司招聘简章,2021-12-01,233
浙江大学医学院附属第一医院2022年（第一批）招聘公告,2021-11-22,208
广州工程技术职业学院2021年人才招聘计划,2021-11-23,206
上海宇勘科技有限公司2022年校园招聘,2021-11-17,236
圣邦微电子2022届校园招聘简章,2021-11-29,278
中博汇高层次人才洽谈会秋季巡回线上面试会,2021-11-15,242
2021年龙口市公开招聘高层次、急需紧缺人才简章,2021-12-09,64
中国人民解放军火箭军工程大学,2021-12-03,465
衡阳镭目科技2022秋季校园招聘,2021-11-16,217
闻泰科技2022校招补招,2021-11-26,259
德阳城市轨道交通职业学院2022年招聘公告,2021-12-09,33
5G速度 智汇广电  江苏有线2022校园招聘,2021-11-30,1000
西安重装渭南橡胶制品有限公司,2021-12-01,225
中国人民解放军空军工程大学人才引进公告,2021-11-22,278
汇聚天下英才 共创钱江时代  杭州市钱江新城投资集团2022届校园招聘,2021-11-29,241
上海轩田工业设备有限公司,2021-11-23,197
舌尖科技（北京）有限公司 2022届校园招聘公告,2021-11-17,226
福建省邮电规划设计院有限公司2022届校园招聘,2021-11-18,239
西安瑞峰光电招聘季来啦！,2021-11-26,275
仪准科技诚聘销售工程师,2021-11-15,204
航天八院802所2022校园招聘简章,2021-11-16,394
航天信息股份有限公司优秀博士毕业生引进“A计划”,2021-11-18,249
上汽通用东岳汽车有限公司,2021-11-30,1009
河南校信通教育科技有限公司2022届招聘,2021-11-22,200
广州南方卫星导航仪器有限公司2022校园招聘简章,2021-12-01,246
在理想的地方遇见更好的你 ——理想汽车2022届校园招聘简章,2021-11-29,269
山东产研微电子技术研究院有限公司,2021-11-16,259
西安煤航遥感信息有限公司,2021-11-23,282
数码视讯科技集团直播互动，速通offer等你挑战,2021-11-17,222
北京方位通讯设备有限公司,2021-11-18,244
关于2022年度湖南省国资委“英培计划”人才选拔公告,2021-11-30,986
正邦集团2022年秋季校园招聘计划,2021-11-22,227
无锡先导智能装备股份有限公司,2021-11-23,220
西安葡萄城校园招聘（测试开发+软件测试实习生）,2021-11-29,269
江西科技职业学院2021年人才招聘公告,2021-11-16,234
“千里之志 机不可失”  千机智能2022校园招聘,2021-12-09,28
科技兴邦 强军报国-国防科技大学第六十三研究所2021-2022年文职、博士后招收,2021-12-01,267
中国科学院微小卫星创新研究院2022届校园招聘补录启动！,2021-11-17,266
山东电力设备有限公司2022届高校毕业生招聘简章,2021-11-30,992
2021年冬季全国博士、博士后、高级人才 巡回签约洽谈会——西安站,2021-12-01,231
宜昌人才服务局携手前程无忧线上双选会西安站正式启动！  最高百万年薪！近2万岗位，就等你,2021-11-29,260
“让未来更具价值”——众阳健康科技集团2022届校园招聘简章,2021-11-18,207
中联重科2022届校园招聘简章,2021-11-22,229
山东山大华天软件有限公司,2021-11-17,225
空军工程大学2022年面向社会公开招考文职人员报考指南,2021-12-05,339
2021年冬季全国博士、硕士研究生巡回 签约洽谈会——西安站,2021-11-30,1021
大华股份旗下子公司---华睿科技2022校园招聘,2021-11-18,266
浙江安防职业技术学院2022年人才需求计划,2021-11-16,243
2022博格华纳中国工程师扬帆项目校园招聘,2021-11-23,225
潍坊银行2022年校园招聘启事（秋季）,2021-11-22,207
杭州市中策职业学校&杭州市中策职业学校钱塘学校  2021年11月批次公开招聘公办事业编制专任教师,2021-12-01,222
第三届“科技绵州 人才飞阳”四川省绵阳市招才引智 “云揽才”系列活动正式开启,2021-11-29,270
长沙农村商业银行股份有限公司公开招聘员工公告,2021-12-09,19
上海烟草机械有限责任公司高层次人才招聘简章,2021-11-17,248
权威发布！国防科技大学2022年文职人员招考公告,2021-12-05,346
江苏开放大学诚邀广大优秀博士及各类高层次人才加入,2021-11-30,949
许昌智能继电器股份有限公司2022校园招聘,2021-12-09,19
深圳北芯生命科技股份有限公司2022届校园招聘火热进行中,2021-11-23,237
 香港科技大学工学院理学硕士（MSc）综合场线上招生宣讲会,2021-11-19,224
亚马逊中国 – 2022年实习生招聘正式启动 !,2021-12-01,273
河南中原消费金融股份有限公司  2022年应届毕业生招聘简章——做普惠者，为“原”梦人,2021-11-22,220
达坦能源科技（上海）有限公司广纳贤才,2021-11-17,231
中国人民解放军空军工程大学2021年秋冬季博士人才现场招聘会,2021-11-29,317
深圳市国立智能电力科技有限公司,2021-11-23,224
珠江实业集团（国企）2022校园招聘正式开启,2021-12-09,24
承德石油高等专科学校,2021-11-22,217
厦门松霖2022届校园招聘简章,2021-12-02,333
西安交通工程学院招聘公告,2021-11-30,1023
国家计算机网络应急技术处理协调中心青海分中心2022年度公开招聘公告,2021-11-23,214
湖南长银五八消费金融股份有限公司2022校园招聘,2021-12-01,227
成都主导科技有限责任公司,2021-11-19,239
给你舞台，让你精彩-同达信恒西安分公司面向理工科招聘,2021-12-07,377
陕西黄河集团有限公司2022校园招聘启航,2021-11-23,278
杭州默安科技有限公司实习生招聘,2021-12-03,361
2022年芜湖职业技术学院赴全国重点院校公开招聘紧缺专业应届毕业生公告（第二批）,2021-12-09,30
烟台东方威思顿电气有限公司2022届校园招聘简章,2021-11-22,207
厦门卫星定位应用股份有限公司 2022届“北斗引航 澎湃未来”校园招聘 正式启航！,2021-12-09,24
【校招】中信证券北京分公司管培生,2021-12-07,174
慧策（北京掌上先机网络科技有限公司）2021年秋季校园招聘,2021-12-06,343
“新起点，新世界“ 一 中控技术2022届校园招聘,2021-11-11,286
北京掌上先机网络科技有限公司,2021-11-11,245
成都中电锦江信息产业有限公司2022年校园招聘,2021-11-11,274
鄂托克旗2021年引进高层次人才公告,2021-11-25,213
中微半导体设备2022校园招聘来啦！,2021-11-11,339
寻找定制梦想家 | 兔宝宝2022校园招聘正式启动！,2021-11-11,239
山西晋钢智造科技实业有限公司11月26日双选会（176号）,2021-11-24,209
鲜丰水果2022届“鲜行者”校园招聘简章,2021-11-11,242
宁波国君源泓投资管理有限公司,2021-11-25,209
横琴粤澳深度合作区2021年博士后招聘公告,2021-11-10,234
小康人寿2022年校园招聘,2021-11-11,239
广州虹科电子科技有限公司2022校园招聘,2021-11-09,251
【西安站】高校人才网2021年秋冬季博士人才现场巡回招聘会邀请函,2021-11-24,239
北京度量科技有限公司2022届校园招聘简章,2021-11-10,224
萧傲青春 银领未来 | 萧山农商银行2022届校园招聘现已启动！,2021-11-08,213
数码视讯科技集团直播互动，速通offer等你挑战,2021-11-09,258
正大贸易（中国）有限公司,2021-11-24,223
深圳市联新移动医疗科技有限公司2022校园招聘,2021-11-11,285
“研创家 营未来”中国移动杭州研发中心（智慧家庭运营中心）2022研创家校园招聘,2021-11-08,282
北京发那科机电有限公司2022招聘简章,2021-11-10,225
江苏曙光光电有限公司,2021-11-11,259
研究生专场——西北地区高校毕业博士、硕士研究生公益空中视频双选会 （参会单位公告）,2021-11-24,251
天津能源投资集团有限公司,2021-11-11,243
中国铁路设计集团有限公司国家工程试验应届、往届博士（博士后）招聘,2021-11-24,214
让创新在线，与智慧同行——联通在线2022校园招聘 正式启动！,2021-11-08,238
深圳小库科技有限公司校招岗位一览,2021-11-11,271
中船重工杰瑞科技控股有限公司 2022年招聘简章,2021-11-08,282
凯迈（洛阳）机电有限公司2022年 招聘简章,2021-11-10,248
重庆信科通信工程有限公司,2021-11-24,224
北京航天广通科技有限公司,2021-11-11,272
深圳大学智能物联网中心杨亚涛特聘教授团队2021年博士后招聘公告,2021-11-09,220
成都成飞航空产业发展有限责任公司,2021-11-11,277
万博科技职业学院2021年招聘启事,2021-11-24,202
金川集团股份有限公司,2021-11-08,236
西安兴汇电力科技有限公司校园招聘,2021-11-11,353
北京深演智能科技股份有限公司,2021-11-10,244
西安中蓝金冷化工新材料有限公司2021年度管培生招聘,2021-11-11,240
商业火箭技术公司【零壹空间】邀您来撩！,2021-11-24,227
深圳农村商业银行股份有限公司 2022金融科技专场校园招聘简章,2021-11-10,218
中国电子科技集团公司第五十三研究所  2022年毕业生招聘计划,2021-11-24,321
领地有为Leading Your Way 这就是你的领地——领地集团2022届校园招聘,2021-11-06,230
慧策（北京掌上先机网络科技有限公司）2021年秋季校园招聘,2021-11-24,204
上海木蚁机器人科技有限公司,2021-11-10,240
有你世界皆春风  春风动力2022全球校园招聘等你来！,2021-11-06,218
福建南方路面机械股份有限公司2022年校园招聘,2021-11-05,235
四川电力设计咨询有限责任公司,2021-11-08,234
洛阳职业技术学院,2021-11-24,217
京东方科技集团股份有限公司,2021-11-24,273
中国人民解放军第五七二一工厂2022年校园招聘公告（河北石家庄）,2021-11-10,343
湖南北云科技有限公司,2021-11-08,221
容知日新2022校园招聘 未来•由你预测,2021-11-05,210
西安高新技术企业协会,2021-11-04,306
中国科学院计算技术研究所2021年秋冬季博士人才视频双选会,2021-11-04,275
江门市“百名博士引进工程”引进公告,2021-11-05,234
SEPHORA丝芙兰2022运营管理培训生校园招聘全面启动！,2021-11-02,198
华天科技（西安）有限公司2022届校园招聘,2021-11-02,380
关于雅安市2021年“雅州英才”工程  赴外招才引智引进高层次人才和急需专业人员的公告,2021-11-02,187
建瓴半导体（广州）有限责任公司招聘简章,2021-11-02,277
安徽农村商业银行系统2022年校园招聘公告,2021-11-01,193
北汽集团2022届校园招聘公告,2021-11-01,249
年薪25万起！紫金矿业集团股份有限公司2021年秋冬季博士人才视频双选会,2021-11-03,315
深圳农村商业银行股份有限公司,2021-11-01,245
蓝鸽集团2022届校园招聘,2021-11-03,237
（世界500强）物产中大金属集团2022届校园招聘,2021-11-04,256
东莞理工学院工程软件创新团队2021年招聘公告,2021-11-02,215
北京未磁科技有限公司招聘工程师,2021-11-05,280
泰康保险集团2022年全球招聘宣讲会——西安电子科技大学场,2021-11-03,226
中国系统2022校园招聘秋季补招,2021-11-02,290
南孔圣地-衢州有礼-事业编制-衢州学院2021年下半年人才招聘公告-评聘高级职称名额充足-解决子女入学,2021-11-09,240
至讯创新科技（无锡）有限公司,2021-11-08,253
中国人民解放军第五七二〇工厂2022年校园招聘,2021-11-04,426
北京数码视讯科技股份有限公司2022届校园招聘,2021-11-03,222
大连大学先进设计与智能计算省部共建教育部重点实验室2021年秋冬季博士人才视频双选会,2021-11-03,228
天之骄子 “辰”风破浪 中国天辰工程有限公司2022年校园招聘简章,2021-11-02,233
【网易有道】2022秋季校园招聘,2021-11-05,267
