title,date,views
组团招聘+苏州张家港市29家市重点企业2021下半年校园引才—西安电子科技大学专场（9月26日下午·南校区B楼109）,2021-09-18,248
中车青岛四方机车车辆股份有限公司2022届毕业生招聘,2021-09-21,233
兴业银行深圳分行2022届校园招聘启事,2021-09-18,178
中国融通集团2022届校园招聘全面启动,2021-09-18,425
中国船舶第七一○研究所  2021年校园招聘简章,2021-09-17,506
陕西联通2022届校园招聘简章,2021-09-17,323
平安启航，荣耀未来                ——平安租赁2022届校园招聘,2021-09-17,200
龙腾半导体股份有限公司2022届校园招聘,2021-09-17,323
不忘初芯，逐梦启源       芯启源2022校园招聘，正式启动！,2021-09-17,194
惠州迪芬尼声学科技股份有限公司,2021-09-17,161
中国科学院沈阳自动化研究所  2021-2022年校园招聘,2021-09-17,211
杭州谱育科技发展有限公司,2021-09-18,141
江西铁塔2022年校园招聘,2021-09-17,171
富士通（西安）系统工程有限公司2022届校园招聘,2021-09-17,238
联咏电子科技（西安）有限公司2022届校招（软件/算法）,2021-09-17,196
四川益丰电子科技有限公司,2021-09-17,187
【校招】阳光保险集团2022届校园招聘计划（多方向）,2021-09-18,144
永赢基金管理有限公司2022年校园招聘,2021-09-17,170
中国信科集团旗下宸芯科技有限公司2022校园招聘,2021-09-18,164
中信银行信用卡中心2022届校园招聘,2021-09-18,282
大众汽车（安徽）有限公司2022年校园招聘简章,2021-09-17,245
北京宇信科技2022届校园招聘简章,2021-09-18,164
星环科技2022届校园招聘来啦！,2021-09-17,173
九江银行股份有限公司,2021-09-17,177
传化智联股份有限公司,2021-09-17,243
研途追梦，技领未来  本田技研科技（中国）有限公司2022年校园招聘！,2021-09-18,182
平安科技2022届全球校园招聘,2021-09-17,170
交叉信息核心技术研究院及入孵企业2022联合校园招聘正式启动,2021-09-17,239
宝宝树集团2022届管培生招聘,2021-09-17,202
戴森2022年秋季校园招聘正式启航,2021-09-18,305
中软融鑫2022年校园招聘简章,2021-09-22,143
浙江中控技术股份有限公司,2021-09-17,214
释放特钢XIN势能——中信泰富特钢集团股份有限公司2022届校园招聘,2021-09-21,180
西安中科立德红外科技有限公司2022校园招聘,2021-09-18,193
碳世代2022届校园招聘简章,2021-09-18,194
平安科技2022届全球校园招聘	,2021-09-17,313
成都主导科技有限责任公司,2021-09-17,204
西安和利时系统工程有限公司,2021-09-18,249
兴唐通信科技有限公司,2021-09-18,329
深圳长城开发科技股份有限公司2022届秋季校园招聘正式开始！,2021-09-17,242
长沙景嘉微电子股份有限公司2022届校园招聘,2021-09-17,201
鹏鼎控股2022届校园招聘简章,2021-09-18,162
厦门卫星定位应用股份有限公司  2022届“北斗引航 澎湃未来”校园招聘  正式启航！,2021-09-17,200
广东省新一代通信与网络创新研究院2022校招简章,2021-09-18,162
中电科星河北斗技术（西安）有限公司2022秋季校园招聘简章,2021-09-18,370
太平洋保险金融科技有限公司（筹）2022校园招聘,2021-09-18,270
本源量子2022年校园招聘-内推启动,2021-09-17,146
成都农商银行2022年校园招聘公告,2021-09-18,141
特步集团2022届全球校园招聘,2021-09-21,187
上海华讯网络系统有限公司,2021-09-17,224
CEC旗下 | 深圳中电投资股份有限公司校园招聘,2021-09-17,182
“科技传世，智达未来”——科世达2022校园招聘,2021-09-18,276
中外运敦豪2022校园招聘,2021-09-18,178
深圳达实智能股份有限公司,2021-09-21,197
浓墨重彩 青春足迹——墨迹天气2022校园招聘正式启动,2021-09-18,147
你就是明星——横店集团2022届校园招聘,2021-09-18,205
兴业银行股份有限公司招聘启示,2021-09-17,222
蚂蚁集团2022届秋季校园招聘,2021-09-18,237
浙江日风电气股份有限公司,2021-09-17,171
珠海华发集团2022届校园招聘简章,2021-09-18,233
江苏银行南通分行2022届校园招聘公告,2021-09-18,128
西安葡萄城信息技术有限公司,2021-09-17,256
智汇湘江  梦想启航  湖南湘江新区发展集团有限公司  2022届校园招聘公告,2021-09-18,176
中国能源建设集团安徽省电力设计院有限公司  2022年高校应届毕业生招聘公告,2021-09-17,213
北京奥维云网22届管培生招聘正式启动,2021-09-17,158
“云计算+大数据”大型企业——品高软件2022校园招聘,2021-09-17,230
“青春智领未来”—实地地产集团2022届种子生招聘,2021-09-18,152
珠海华发集团2022届校园招聘简章,2021-09-18,287
东方红资产管理2022届秋季金融科技校园招聘正式启动！,2021-09-22,218
广州联通2022届校园招聘简章,2021-09-18,215
苏州张家港市29家市重点企业2021下半年校园引才—西安电子科技大学专场（9月26日下午·南校区B楼109）,2021-09-17,221
成都芯源系统有限公司-本科专场,2021-09-22,240
中建八局浙江建设有限公司招聘简章,2021-09-17,193
中睿天下2022校园招聘简章,2021-09-18,233
中国东方电气集团有限公司2022校园招聘,2021-09-18,300
【合肥】容知日新2022校园招聘 未来.由你预测,2021-09-18,194
完美世界2022校园招聘西电站专场来啦,2021-09-17,215
中国民生银行信用卡中心2022届科技人才校园招聘,2021-09-18,196
深圳北芯生命科技股份有限公司2022届校园招聘,2021-09-17,190
中核浦原校招宣传简章,2021-09-17,180
无锡先导高端智能装备华南总部 珠海泰坦新动力电子有限公司2022届校园招聘简章,2021-09-18,254
才汇琶洲  共赢未来——2022广州琶洲人工智能与数字经济企业知名高校行,2021-09-18,224
华发股份2022届校园招聘简章,2021-09-22,136
航空工业第一飞机设计研究院2022招聘简章,2021-09-17,497
浙江巨磁智能技术有限公司【长沙研发中心】-22届秋季校园招聘,2021-09-18,197
福建慧芯激光科技有限公司2022届校园招聘,2021-09-18,191
正青春 芯动力  --------塔菲尔新能源科技2022校园招聘,2021-09-18,257
渤海银行股份有限公司西安分行,2021-09-17,225
成都乐狗科技有限公司2022届秋季校园招聘,2021-09-18,198
交叉信息核心技术研究院及入孵企业2022联合校园招聘正式启动,2021-09-18,205
杭州聚光科技2022届校园招聘,2021-09-18,243
英韧科技(上海)有限公司2021年校园招聘,2021-09-17,213
智启梦想，医飞冲天|GE医疗2022校园招聘正式开启,2021-09-18,292
蝉鸣科技（西安）有限公司,2021-09-22,283
联咏电子科技（西安）有限公司2022届校招（软件/算法）,2021-09-18,245
爱立信（中国）通信有限公司,2021-09-17,255
北京发那科机电有限公司,2021-09-17,227
航天新通2022届秋季校园招聘简章,2021-09-18,209
科技延伸的星空——  WeLab汇立集团2022届校园招聘,2021-09-18,263
紫薇地产2022年秋季校园招聘公告,2021-09-19,188
松山湖材料实验室2022届校园招聘，即日启动！,2021-09-17,215
深圳市德卡科技股份有限公司,2021-09-18,148
一径科技2022校园招聘,2021-09-22,268
普睿司曼2022年国际管理培训生项目,2021-09-19,163
顺势而为，造梦未来  —顺造科技2022秋季校园招聘,2021-09-18,254
Airwallex空中云汇2022届校园招聘正式启动！,2021-09-18,227
深圳保诚科技有限公司  --英国保诚亚洲金融科技研发中心,2021-09-18,259
KOCH科氏工业集团2022校园招聘,2021-09-17,391
广汽研究院2022校园招聘,2021-09-19,238
庆铃汽车（集团）有限公司,2021-09-22,212
信锐技术2022届全国校园招聘,2021-09-18,303
中国人民解放军第五三一一工厂2022届校园招聘简章,2021-09-17,360
乐山市商业银行  2022秋季校园招聘公告,2021-09-17,163
三花控股集团2022“扬帆计划”  管培生招聘简章,2021-09-17,200
浙江智臾科技有限公司,2021-09-18,238
航天恒星空间技术应用有限公司,2021-09-18,194
启事浙商银行杭州分行2022年校园招聘,2021-09-19,160
年薪高达35万！20年电源研发上市企业深圳市英可瑞科技宣讲会(9月24日）,2021-09-18,204
博格华纳（中国）投资有限公司,2021-09-18,191
成都中电锦江信息产业有限公司2022年校园招聘,2021-09-17,237
中国中化集团国有装备制造企业南京天华公司2022年招聘,2021-09-18,149
西安建工集团有限公司,2021-09-18,319
中国信息通信科技集团2022校园招聘简章,2021-09-17,482
2022一飞院招聘简章,2021-09-22,231
航天恒星空间技术应用有限公司,2021-09-18,272
北方夜视科技（南京）研究院有限公司2022校园招聘简章,2021-09-19,258
交通银行宁波分行2022年秋季校园招聘公告,2021-09-18,145
深圳电器公司,2021-09-18,225
“视界无限，宇你同行”——宇视科技2022届校园招聘简章,2021-09-18,184
南京长江电子信息产业集团有限公司,2021-09-19,237
华灿光电（浙江）有限公司2022届应届毕业生校园招聘简章,2021-09-18,147
杭州凯龙医疗器械有限公司,2021-09-22,153
中国移动北京公司2022年秋季校园招聘,2021-09-18,203
中国工商银行远程银行中心2022年秋季校园招聘,2021-09-18,206
西安图为电气技术有限公司2022校园招聘,2021-09-18,184
广西北投信创科技投资集团有限公司  2022届高校毕业生校园招聘公告,2021-09-17,141
聚融医疗科技 | 2022校招,2021-09-17,223
科技引领 大有作为—西安科为实业发展有限责任公司,2021-09-16,212
广揽强国英才  共奔无限前程——江苏无线电厂有限公司2022届校园招聘,2021-09-15,178
飞腾信息技术有限公司,2021-09-17,212
楚航科技2022届校园招聘,2021-09-16,218
创维集团有限公司2022届校园招聘,2021-09-16,251
“招”唤理想，“证”当青春——招商证券2022校园招聘盛大启动！,2021-09-15,266
世界团队 职等你来  扬帆远航 创造梦想  加入来颉科技共创未来,2021-09-16,213
青矩技术股份有限公司2022校招招聘,2021-09-15,194
中国移动湖北公司招聘公告,2021-09-16,203
中电科航空电子有限公司2022年校园招聘,2021-09-16,413
上海华讯网络系统有限公司,2021-09-15,232
连云港杰瑞电子有限公司2022年招聘简章,2021-09-15,200
中移铁通广西分公司2022年度大学毕业生招聘公告,2021-09-16,175
北京集佳知识产权代理有限公司西安分公司2022年校园招聘,2021-09-16,188
柔电院9月18日空宣来袭,2021-09-15,249
兴唐通信科技有限公司,2021-09-16,222
城银清算服务有限责任公司2021年校园招聘公告,2021-09-15,245
江苏省电力设计院有限公司2022年校园招聘,2021-09-16,205
中国轻工建设工程有限公司,2021-09-16,215
徐州工程机械集团有限公司2022年校园招聘,2021-09-16,228
“梦想靠岸”招商银行天津分行2022秋季校园招聘公告,2021-09-16,178
深圳市桑达无线通讯技术有限公司2022年校园招聘启事,2021-09-16,196
AMD 2022 校园招聘,2021-09-15,482
中国移动通信集团陕西有限公司2022校园招聘公告,2021-09-16,228
“智慧影像，由你来创”东软医疗2022校园招聘正式启动！,2021-09-15,230
人大金仓2022校园招聘公告,2021-09-16,182
长沙智能驾驶研究院2022校园招聘,2021-09-15,336
启元世界2022届校园招聘,2021-09-16,612
交银金科2022年秋季校园招聘简章,2021-09-15,185
华信咨询设计研究院有限公司2022届秋季校园招聘简章,2021-09-16,176
深圳市同为数码科技股份有限公司,2021-09-15,170
中国再保险（集团）股份有限公司  2022届校园招聘简章,2021-09-16,199
中国电信安徽公司2022届校园招聘,2021-09-15,212
中国农业发展银行福建省分行2022年校园招聘公告,2021-09-16,241
深圳综合粒子设施研究院2021年校园招聘,2021-09-16,176
中科院空天院2022年校园招聘（9.17西电专场宣讲会）,2021-09-16,350
中国华能集团清洁能源技术研究院有限公司 2022年校园招聘公告,2021-09-16,156
中国科学院武汉岩土力学研究所,2021-09-16,183
中国银行江苏省分行2022年校园招聘公告,2021-09-15,163
中国建设银行河北省分行2022年度校园招聘公告,2021-09-16,211
山东众阳健康科技集团有限公司,2021-09-15,162
广西柳工2022届校园招聘已盛势开启,2021-09-16,225
梦起湾区，RUN 向未来——珠海华润银行2022届秋季校园招聘简章,2021-09-15,167
中国银行股份有限公司广东省分行2022年校园招聘简章,2021-09-15,198
兴业数金2022届校园招聘启事,2021-09-15,183
中国农业银行股份有限公司,2021-09-15,196
思必驰2022届秋季校园招聘,2021-09-16,300
货拉拉2022校园招聘——技能拉满 HUO力全开,2021-09-14,171
昕诺飞2022年校园招聘,2021-09-15,175
成都西科微波通讯有限公司招聘简章,2021-09-14,162
中国移动在线营销服务中心2022届年秋季校园招聘,2021-09-15,164
“梦想靠岸”招商银行南宁分行2022秋季校园招聘公告,2021-09-14,135
北京农商银行2022年校园招聘公告,2021-09-14,142
中国建设银行四川省分行2022年度校园招聘公告,2021-09-14,133
华虹集团2022届校园招聘正式启动,2021-09-14,163
康耐视2022校招简章,2021-09-14,141
北京小鸟科技股份有限公司2022年校园招聘简章,2021-09-14,145
恰青春，正当燃—当当网2022校园招聘公告,2021-09-14,143
中国邮政储蓄银行广东省分行2022年校园招聘,2021-09-14,158
东风汽车集团有限公司2022全球校园招聘,2021-09-14,207
“粤”过千川，聚水成海——粤海水务2022届校园招聘火热进行中,2021-09-14,135
航空工业南京机电2022校园招聘简章,2021-09-15,361
中国邮政储蓄银行河南省分行2022校园招聘公告,2021-09-14,192
长飞光纤光缆股份有限公司2022校园招聘简章,2021-09-14,134
中国移动通信集团江苏有限公司2022秋季校园招聘公告,2021-09-15,161
阿里云智能客户经理岗  2022届校园招聘简章,2021-09-15,205
美芯晟青年计划正在招募中——2022年校园招聘计划,2021-09-14,189
中车青岛四方车辆研究所有限公司2022秋季校园招聘,2021-09-14,174
边锋网络2022校园招聘,2021-09-14,140
名创优品2022届校园招聘启示,2021-09-14,139
科顺防水科技股份有限公司2022届校园招聘,2021-09-14,134
箭航天2022届秋季校园招聘简章,2021-09-16,292
"""欣""世界，由你“zao”！欣旺达2022届校园招聘简章",2021-09-15,211
哈尔滨电气集团有限公司  2022届校园招聘正式启动,2021-09-15,342
你的未来  天翼飞YOUNG——中国电信四川公司2022秋季校园招聘公告,2021-09-15,193
许继集团有限公司2022年校园招聘公告,2021-09-15,206
卓品智能科技无锡有限公司,2021-09-16,170
西安因子元素科技有限公司2022届毕业生校园招聘,2021-09-14,155
“驱动未来的喜悦”  广汽本田2022校园招聘已启动！,2021-09-14,167
申万宏源证券2022届“新申力计划”秋季校园招聘正式启动,2021-09-14,138
用心物色未来——物产中大集团2022校园招聘开启啦~,2021-09-15,171
上汽变速器2022届秋季校园招聘,2021-09-15,219
金融壹账通2022届校园招聘启事,2021-09-15,168
招商银行深圳分行2022秋季校园招聘,2021-09-14,147
招商银行信用卡2022届校园招聘正式启动！,2021-09-15,224
米哈游公司2022届秋季校园招聘,2021-09-14,192
中国航空工业集团公司上海航空测控技术研究所,2021-09-16,258
BOSS直聘2022秋季校园招聘火热进行中--本月18号有一场技术类笔试！网申十月中旬截止！,2021-09-15,198
中国建设银行湖北省分行2022年度校园招聘公告,2021-09-15,182
巨一科技2022届全球校园招聘,2021-09-16,233
中国航天科工集团第六研究院2022届校园招聘,2021-09-15,301
成都华托微纳智能传感科技有限公司校招简章,2021-09-14,151
凡是过往  皆为序章 乘风破浪  未来可期——Baicells  2021年校园招聘,2021-09-15,218
中国兵器工业集团第二一四研究所苏州研发中心,2021-09-14,194
广州天维信息技术股份有限公司2022届校园招聘简章,2021-09-14,133
武汉光谷卓越科技股份有限公司,2021-09-16,215
浦汇金英 创造卓越——浦发银行2022年度校园招聘启事,2021-09-15,197
为绿色能源星球奋斗 上海电力设计院有限公司2022届校园招聘,2021-09-15,181
中国航发湖南南方宇航工业有限公司2022校园招聘,2021-09-15,261
中国航空国际建设投资有限公司,2021-09-14,151
紫光华智2022届秋季校园招聘,2021-09-15,216
交叉信息核心技术研究院及入孵企业2022联合校园招聘正式启动,2021-09-16,199
北汽福田汽车股份有限公司2022校园招聘,2021-09-14,128
长城电源技术有限公司,2021-09-15,281
中关村空间信息产业技术联盟,2021-09-14,153
深圳能源集团股份有限公司2022届校园秋季招聘启事,2021-09-15,203
中国船舶第七〇九研究所2022年校园招聘,2021-09-15,319
深圳麦科田生物医疗技术股份有限公司2022届校园招聘,2021-09-14,144
华电云南发电有限公司2022届毕业生招聘公告,2021-09-16,212
云上贵州大数据产业发展有限公司2022届校园招聘,2021-09-15,196
珠海格力电器2022秋季西安电子科技大学宣讲安排,2021-09-16,258
中国电子科技集团公司第九研究所2021-2022年校园招聘,2021-09-14,301
特发集团2022年度校园招聘,2021-09-15,281
江苏万邦生化医药集团有限责任公司,2021-09-15,166
东风小康汽车有限公司招聘简章,2021-09-16,156
龙马环卫2022校园招聘,2021-09-14,131
中国兵器工业集团第二〇二研究所2022届校园招聘,2021-09-16,291
河北远东通信系统工程有限公司  招 聘 信 息,2021-09-15,185
2022届校园招聘简章,2021-09-15,398
中骏集团铜川世界城“  骏耀青春 绽FUN未来”2022届“骏耀生”秋季校园招聘公告,2021-09-15,147
中国航发沈阳发动机研究所2022届校园招聘全面启动,2021-09-14,187
厦门钨业-厦门虹鹭钨钼工业有限公司2022年校园招聘,2021-09-16,147
浙江国自机器人技术股份有限公司 2022校园招聘,2021-09-14,144
福建工程学院2022年师资招聘,2021-09-15,177
哪吒汽车2022届校园招聘,2021-09-14,161
西安博研微纳信息科技有限公司,2021-09-14,168
深圳华大基因科技有限公司,2021-09-16,209
中国汽车技术研究中心有限公司2022校园招聘,2021-09-16,252
中国建设银行广东省分行2022年度校园  招聘公告,2021-09-15,174
杭州数梦工场2022届校园招聘,2021-09-15,180
江苏银行上海分行2022届校园招聘简章,2021-09-15,162
“源”创智造，“兴”动未来 华兴源创2022校园招聘,2021-09-16,163
江苏银行苏州分行2022届校园招聘公告,2021-09-15,166
中国船舶集团有限公司第八研究院  （南京·原七二四所）2022届校园招聘,2021-09-16,335
大连西太平洋石油化工有限公司2022校园招聘公告,2021-09-15,155
乘风破浪 共创无限可能 | 共创草坪2022届校园招聘正式启动,2021-09-15,158
广州匠芯创科技有限公司2022届校园招聘,2021-09-14,147
芯和半导体2022校园招聘简章,2021-09-16,202
扬帆启航，翼起飞扬  ——中国电信重庆公司2022年校园招聘公告,2021-09-15,181
“梦想靠岸”招商银行2022校园招聘公告,2021-09-15,205
建信金融科技有限责任公司2022年度校园招聘公告,2021-09-15,402
大族数控2022届“新控族”全球校园招聘正式启动,2021-09-14,153
斗鱼直播2022校园招聘宣讲会,2021-09-14,179
卓越不凡，引领未来/杭州云深处科技2022届校园招聘,2021-09-16,174
延长壳牌石油有限公司2022校园招聘,2021-09-15,393
四维图新集团2022届校园人才招聘简章,2021-09-15,207
烟台东方威思顿电气有限公司2022秋季校园招聘,2021-09-16,155
北京中电普华信息技术有限公司 2022校园招聘简章,2021-09-14,160
中国航天科技集团第五研究院总体设计部2022年校园招聘,2021-09-15,282
晶选之才 浙般非凡  ——水晶光电2022届校园招聘简章,2021-09-14,173
马上消费-2022届秋季招聘简章,2021-09-14,139
构年轻，GO未来-即构科技2022校园招聘,2021-09-15,194
美光半导体（西安）有限责任公司,2021-09-16,574
深圳市得润电子股份有限公司2022届校园招聘,2021-09-16,164
联咏电子科技（西安）有限公司2022届校招（软件/算法）,2021-09-15,198
北京掌上先机网络科技有限公司2022校招进行中,2021-09-15,182
常州宝菱重工机械有限公司,2021-09-15,181
中国建设银行苏州分行2022年度校园招聘公告,2021-09-14,156
飞利浦中国2022秋季校园招聘,2021-09-15,211
中国移动云能力中心2022秋季校园招聘正式启动!,2021-09-15,222
河钢集团供应链管理有限公司,2021-09-16,161
贵阳市创业投资有限公司2021年度校园招聘,2021-09-16,185
平安银行信用卡中心2021校园招聘公告,2021-09-15,166
机械九院2022年度全球校园招聘——九等你来  虚位以待 DREAM,2021-09-15,211
威海市商业银行2022年度秋季校园招聘,2021-09-14,142
【趋势科技2022届秋季校园招聘公告】,2021-09-14,147
中国工商银行苏州分行2022年度秋季校园招聘公告,2021-09-14,171
投毫玩家 智行未来  ——百万量产，领跑中国自动驾驶【毫末智行2022年秋季校招启动】,2021-09-15,183
“欣起点·奕起来”——欣奕华集团2022校园招聘简章,2021-09-16,177
维信电子有限公司2022年校招,2021-09-15,187
中骏集团2022届“骏耀生”秋季校园招聘	,2021-09-15,214
中国农业发展银行2022年度校园招聘公告,2021-09-15,219
天之骄子 “辰”风破浪——中国天辰工程有限公司2022年校园招聘简章,2021-09-16,175
广东宽普科技有限公司,2021-09-16,171
中国电信广东公司2022年校园招聘公告,2021-09-15,188
海科融通2021校园招聘,2021-09-15,167
链不凡，汇非凡  征和管培生计划-2022届校园招聘,2021-09-15,169
杭州芯迈半导体技术有限公司-招纳贤士,2021-09-16,262
华数传媒2022校园招聘,2021-09-14,141
九洲集团2022年校园招聘简章,2021-09-14,334
优炫软件2022校园招聘,2021-09-13,190
中国电子科技南湖研究院,2021-09-14,286
郑煤机集团2022秋季校园招聘启事,2021-09-14,248
浙江创邻科技有限公司,2021-09-13,173
山东移动2022秋季校园招聘公告,2021-09-14,239
浙江巨磁智能技术有限公司【长沙研发中心】-22届秋季校园招聘,2021-09-13,169
中国移动江西公司2021年校园招聘,2021-09-13,163
联通数字科技有限公司2022秋季校园招聘正式启动,2021-09-13,194
广汽集团2022校园招聘简章,2021-09-14,227
一汽奔腾2022全球校园招聘,2021-09-13,236
量道（深圳）储能科技有限公司招贤纳士,2021-09-14,181
【服务国家建设 人才优选计划】美亚柏科集团2022宣讲会 — 9月17日南校区418宣讲室，期待优秀的你！,2021-09-13,149
盈峰环境科技集团股份有限公司2022届校园招聘,2021-09-14,230
上海航天电子有限公司2022校园招聘,2021-09-13,283
联咏电子科技（西安）有限公司,2021-09-13,171
因美纳2022年秋季校园招聘,2021-09-14,236
中国电科五十所2022校园招聘公告,2021-09-13,250
阿斯利康2022届管培生项目高燃来袭！,2021-09-14,243
“梦想靠岸”招商银行上海分行2022校园招聘公告,2021-09-13,130
一起定义新边界|移动研究院2022校园招聘正式启动,2021-09-14,262
中国人民解放军第5719工厂校园招聘（9月15日）,2021-09-14,445
中国航空工业集团上海航空电器有限公司2022届招聘,2021-09-13,205
中电科技集团重庆声光电有限公司模拟集成电路国家级重点实验室招聘洽谈会9月16日  9:00-10:30北校区东大楼321B,2021-09-13,188
中石油勘探院西北分院2022校园招聘正式启动,2021-09-14,283
广州通达汽车电气股份有限公司2022校招（技术类/综合类）,2021-09-14,192
中国航天科工集团第四研究院十七所2022届毕业生招聘,2021-09-13,238
中国航发商发2022届校园招聘简章,2021-09-13,237
共铸“中国心”，圆你“航空梦”——中国航发哈尔滨东安发动机有限公司2022校园招聘,2021-09-13,169
未来视不可挡|海康威视2022届全球校园招聘简章,2021-09-13,201
中国科学院光电技术研究所2022年校园招聘,2021-09-14,480
中铁物贸集团有限公司,2021-09-13,242
西安中科立德红外科技有限公司2022校园招聘,2021-09-14,263
中移物联网有限公司 2022届校园招聘招生简章,2021-09-13,155
9月16日19:00！招商银行西安分行2022校园招聘线上宣讲会来袭！ 浩瀚招银星球 寻找最闪耀的你！,2021-09-14,246
启梦在沃，支付未来——联通支付2022校招,2021-09-13,173
招商银行海口分行2022届季校招,2021-09-14,128
富途网络科技（深圳）有限公司,2021-09-14,248
才汇紫金 宁聚梦想——紫金山实验室2022届校园招聘正式启动,2021-09-13,164
海尔集团2022未来合伙人招聘简章,2021-09-12,172
宏胜饮料集团2022届校园招聘,2021-09-14,206
中国船舶第七一二研究2022届校园招聘简章,2021-09-12,189
