title,date,views
“梦想靠岸”招商银行福州分行2022校园招聘公告,2021-09-27,165
“交天下英才 投美好未来”江西省交通投资集团有限责任公司2022年校园招聘,2021-09-27,168
 中原银行2022年秋季校园招聘启事,2021-09-26,185
中航空管系统装备有限公司招聘简章,2021-09-27,238
西安募格网络科技有限公司,2021-09-27,218
福建省晋华集成电路有限公司招聘简章,2021-09-26,181
中国联通四川省分公司2021年（2022届）  秋季校园招聘公告（第一批）,2021-09-27,204
中国移动江苏公司徐州分公司2022秋季校园招聘公告,2021-09-26,185
无锡先进技术研究院2022年校园招聘简章,2021-09-26,224
科技强国，材华启航|  泽融公司 2022 届校园招聘全面开启,2021-09-27,232
西安源捷科技有限公司招聘简章,2021-09-27,205
联咏电子科技（西安）有限公司2022届校招火热进行中（软件/算法）,2021-09-27,205
东莞徐记食品有限公司2022届校园招聘,2021-09-29,201
恩智浦2022校园招聘,2021-09-27,213
中国铁塔重庆公司2022年度校园招聘简章,2021-09-28,176
交通银行江西省分行2022秋季校园招聘公告,2021-09-27,173
移卡集团  2022届秋季校园招聘,2021-09-27,218
“宜”见倾“兴” 2021宜兴市云上才交会公告,2021-09-27,214
国家级经济技术开发区——镇江新区诚聘英才,2021-09-27,220
中德证券有限责任公司2022年校园招聘,2021-09-27,189
民生科技有限公司2022届校园招聘计划,2021-09-27,218
意昂神州- 中原国际新能源汽车研究院2021年校园招聘,2021-09-27,191
中国移动党校（中国移动人才发展中心）2022校园招聘,2021-09-29,289
上海市金山区2022年储备人才招录公告,2021-09-27,154
百融2022校园招聘简章,2021-09-27,200
广州禾信仪器股份有限公司2022届校园招聘宣讲,2021-09-28,162
“激情梦想、光耀未来”大族激光2022校园招聘火热进行中,2021-09-28,163
深圳盈达2022届校园招聘,2021-09-29,192
西安精密机械研究所昆明分部,2021-09-28,280
强生2022届秋季校园招聘,2021-09-29,651
苏州迈为科技股份有限公司2022年“迈进生”校园招聘简章,2021-09-27,263
财信吉祥人寿保险股份有限公司  2022年应届毕业生校园招聘简章,2021-09-27,174
北京思朗科技有限责任公司,2021-09-27,224
金百泽2022年全国校园招聘,2021-09-29,194
北京智明星通科技股份有限公司,2021-09-27,239
广东宝莱特医用科技股份有限公司,2021-09-28,176
公牛集团股份有限公司——2022校园招聘,2021-09-28,202
中国大唐集团科学技术研究院有限公司西北电力试验研究院,2021-09-27,358
统信软件技术有限公司2022届校园招聘,2021-09-28,193
深圳赛意法微电子有限公司2022年校园招聘正式启动,2021-09-29,228
佛山地铁2022届校园招聘公告,2021-09-28,156
光大证券2022校园招聘公告,2021-09-29,204
深圳市奥昇医疗科技有限责任公司,2021-09-27,172
交通银行信用卡中心2021年秋季校园招聘简章,2021-09-27,243
重庆超硅半导体有限公司,2021-09-27,197
顺丰同城2022届秋季校园招聘简章,2021-09-28,163
北京与之科技有限公司2021年秋季校园招聘,2021-09-28,199
智能无人飞行器—西安科为实业发展有限责任公司2022届优科生招募,2021-09-27,258
云南白药集团2022届校园招聘之旅——白药弥新，志在生机,2021-09-28,196
西安软通动力网络技术有限公司,2021-09-29,266
嘉兴银行2022年度校园招聘,2021-09-27,145
江苏长晶科技有限公司,2021-09-27,265
数码视讯科技集团2022届校园招聘,2021-09-27,213
云璟科技2022校园招聘,2021-09-28,196
中国移动浙江公司诚邀2022届校园应届毕业生加盟！,2021-09-28,178
世界五百强医疗行业龙头企业——【美敦力】2022校园招聘开始啦！,2021-09-29,318
达诚基金管理有限公司2022年招聘信息,2021-09-28,163
远东宏信/远东国际融资租赁有限公司2022届“铸剑计划”校园招聘,2021-09-27,148
四川银行股份有限公司  2022校园招聘公告,2021-09-27,141
中国移动咪咕公司2022校园招聘，热招岗位持续招聘中！,2021-09-29,236
凯迈（洛阳）测控有限公司2022年校园招聘公告,2021-09-27,202
360集团2022全球校园招聘,2021-09-28,225
湖南财信金融控股集团有限公司,2021-09-27,187
合肥科技农村商业银行2022年  员工招聘启事,2021-09-29,157
武汉药明康德新药开发有限公司2022校园招聘简章,2021-09-27,183
北控水务集团2022届校园招聘——水接云作岸，山高我为峰,2021-09-28,238
天隆科技2022届校招招聘简章  天隆匠 不一Young,2021-09-29,234
汇添富基金2022校园招聘（IT招聘专场）,2021-09-29,201
中国科学院海西研究院泉州装备制造研究所 信号处理与微波系统创新团队招聘启事,2021-09-27,199
  辽宁移动2022校园招聘 和你移起 一路领先,2021-09-27,212
中国北方发动机研究所  China North Engine Research Institute  招聘简章,2021-09-27,190
联咏电子科技（西安）有限公司2022届校招（软件/算法）--双休,2021-09-28,241
荣耀HONOR 2022届营销服务部校招开启,2021-09-27,224
北京国双2022年校园招聘 ——初生一派，数智未来,2021-09-29,210
魅力徐工 你的舞台 徐工2022校园招聘博士专场,2021-09-29,185
上汽通用五菱汽车股份有限公司,2021-09-29,188
武汉博畅通信设备有限责任公司校招,2021-09-27,208
税友软件集团股份有限公司,2021-09-28,242
陕西长岭软件开发有限公司,2021-09-27,210
“为白衣持盾 让梦想启航” 建发医疗2022届联合校园招聘简章,2021-09-30,260
中国太平保险集团2022校园招聘,2021-09-29,181
“华南筑梦营”—中建五局华南公司  2022届校园招聘,2021-09-28,162
中国移动通信集团河北有限公司招聘简章,2021-09-29,174
达涅利中国2022校园招聘简章,2021-09-27,211
高层次人才洽谈会 （2021年度）秋季巡回面试会---西安站,2021-09-29,260
厦门法拉电子股份有限公司,2021-09-28,196
【豪迪启航 奕力芯光芒】 2022年豪迪微电子招聘活动开始!!,2021-09-27,189
中国第一汽车股份有限公司,2021-09-29,272
平安点创租赁2022届秋季校园招聘邀请函,2021-09-27,138
艾索信息股份有限公司2022届校园招聘,2021-09-27,264
北京金茂产城科技发展有限公司,2021-09-28,191
中国衣恋集团2022秋季校园招聘,2021-09-29,156
Qualcomm高通（中国） 2022应届毕业生招聘信息,2021-09-27,299
中国网安（含中国电科三十所）2022届校园招聘,2021-09-27,312
烽火通信科技股份有限公司 校园招聘简章,2021-09-27,256
苏州鸿凌达电子科技有限公司2022校园招聘,2021-09-29,208
中国电信股份有限公司河南分公司2022年校园招聘,2021-09-27,230
石家庄科林电气股份有限公司2022届校园招聘,2021-09-29,189
一起开创 “我”的数字世界,2021-09-28,167
“服务央行，筑梦成方”-成方金融科技有限公司2022年校园招聘,2021-09-28,199
上市企业-科华数据2022届校园招聘信息,2021-09-29,190
福建慧芯激光科技有限公司2022届校园招聘,2021-09-27,168
湖南财信金融控股集团有限公司2022全球校园招聘,2021-09-28,142
上海仪准电子科技有限公司,2021-09-29,267
惠州亿纬锂能股份有限公司,2021-09-29,193
恒烁半导体（合肥）股份有限公司招聘简章,2021-09-27,200
杭州时代银通2022年校园招聘,2021-09-29,161
2022年中国电信福建公司秋季招聘启事,2021-09-27,183
中国电子科技集团公司第二十七研究所2022年度招聘简章,2021-09-28,1081
TCL格创东智！工业互联网领军企业！线下招聘活动正式上线！赶紧进来了解一下！工业+互联网，想象无限宽广！,2021-09-29,261
北京机电工程研究所,2021-09-27,249
恒丰银行2022校园招聘启事,2021-09-29,185
数字未来 科创新生——联通数字科技有限公司2022秋季校园招聘正式启动,2021-09-27,236
航天行云(航天科工四院卫星总体单位)2022年度校园招聘,2021-09-27,550
中国科学院微小卫星创新研究院2022届校园招聘,2021-09-28,270
Coach零售管理培训生校园招募活动正式启动,2021-09-27,176
西安市万科物业服务有限公司,2021-09-27,205
陕西鼓风机（集团）有限公司,2021-09-29,317
千寻位置网络有限公司-2022校园招聘全面开启,2021-09-29,170
中国西电集团有限公司招聘启事,2021-09-27,798
天鹅到家2022校园招聘——来到家 绽放翼young精彩,2021-09-29,186
深圳天源迪科信息技术股份有限公司西安分公司,2021-09-28,193
臻迪PowerVision 2022校园招聘,2021-09-29,193
电材探秘、筑梦有你 中国电科46所2022年校园招聘,2021-09-29,357
中国光大银行北京分行2022年秋季校园（金融科技类）招聘启事,2021-09-28,173
云南省贵金属新材料控股集团有限公司2022年校园招聘公告,2021-09-29,199
中国移动总部网络事业部2022校园招聘正式启动,2021-09-27,280
TCL格创东智！工业互联网领军企业！西安站校招热烈进行中！,2021-09-28,235
中机六院2022年度秋季招聘简章,2021-09-29,301
信梦想，期未来 | 中信期货2022校园招聘,2021-09-28,160
贵州电信2022校园招聘公告,2021-09-26,203
华侨城集团2022届校园招聘,2021-09-26,178
上海移远通信技术股份有限公司,2021-09-26,175
【墨芯人工智能】2021年校园招聘正式启动,2021-09-25,188
中国铁塔股份有限公司陕西省分公司2022年度“青苗计划”校园招聘,2021-09-26,245
Sitech思特奇2022届校园招聘简章,2021-09-26,229
中国人寿财险金融科技中心2022届校园招聘简章,2021-09-26,187
想不想一起看火箭发射！北京凌空天行科技有限责任公司2022届校园招聘全面开启！,2021-09-26,402
Ample2022年校园招聘全面启动,2021-09-24,247
贝壳找房2022届省区ADC校园招聘简章,2021-09-25,161
中国建设银行信用卡中心2022年度校园招聘,2021-09-26,215
湖南泛联新安信息科技有限公司,2021-09-26,167
中国银行南通分行2022年校园招聘公告,2021-09-24,138
德施曼2022探“锁”计划,2021-09-24,199
江苏希西维轴承有限公司22年校园招聘（本科9-12K 研究生12-15k）,2021-09-26,193
鲜丰水果2022届“鲜行者”校园招聘简章,2021-09-26,163
星源材质2022届校园招聘简章,2021-09-26,197
触梦未来，寻找发光的你！  西安四叶草信息技术有限公司2022校园招聘,2021-09-24,263
中国光大银行2022年校园招聘启事,2021-09-24,359
招商证券股份有限公司,2021-09-26,204
招商银行西安分行 9月27日晚19：00！“小招面对面”第三场线上宣讲会，学长学姐与你面对面交流！,2021-09-26,202
  新城控股2022「新睿计划」校园招募全球启动,2021-09-26,194
东风商用车技术中心秋季校园招聘公告,2021-09-26,197
【年薪33W+的双休互联网IT公司——帆软西电线下&线上宣讲】,2021-09-26,250
网易“星火计划”2022届HR培训生招募,2021-09-24,374
东风特种商用车有限公司招聘简章,2021-09-26,201
中国光大银行南宁分行2022年  秋季校园招聘启事,2021-09-26,158
利郎（中国）有限公司2022届校园招聘,2021-09-24,179
陕西万客云信息技术有限公司,2021-09-24,258
中信银行股份有限公司深圳分行招聘简章,2021-09-26,174
上海水星家用纺织品股份有限公司,2021-09-24,163
东风柳州汽车有限公司招聘简章,2021-09-26,165
浙江省水利水电勘测设计院2022年校园招聘公告,2021-09-24,163
上交所技术有限责任公司2022校园招聘,2021-09-26,222
触梦未来，寻找发光的你     西安四叶草信息技术有限公司2022校园招聘,2021-09-24,188
东风汽车集团有限公司特种装备事业部（东风越野车有限公司）2021年校园招聘,2021-09-26,281
专利审查协作中心  面向全国公开招聘专利审查员,2021-09-26,220
叠纸游戏2022秋季校园招聘正式启动,2021-09-26,201
国家计算机网络应急技术处理协调中心广西分中心2022年度公开招聘,2021-09-26,208
霍尼韦尔2022校园招募,2021-09-26,219
广东博达科技有限公司,2021-09-24,192
华润数科2021年校园招聘简章,2021-09-26,315
深圳市创梦天地科技有限公司,2021-09-24,174
济南产业发展投资集团2022年秋季校园招聘简章,2021-09-26,180
吉利学院 2022 校园招聘,2021-09-25,193
广州市保伦电子有限公司,2021-09-24,249
中核工程咨询有限公司2022届校园招聘,2021-09-26,198
“筑梦锐鹰，传感未来” ——锐鹰传感2022届校招简章,2021-09-23,210
广州诗悦网络2022校园招聘全面开启,2021-09-24,161
远洋集团2022届校园招聘正式启动！,2021-09-23,234
西安华瑞恒泰信息技术有限公司,2021-09-24,232
富士康科技集团McEG华东园区2022届招聘简章,2021-09-23,223
浙江前程照明有限公司2022届校园招聘,2021-09-23,178
中国通信建设集团设计院有限公司,2021-09-22,251
深圳市属国企2022校园招聘活动拉开帷幕  ——“菁英聚鹏城”“线上+线下”融合全球揽才,2021-09-22,373
青藤云安全2022届秋季校园招聘,2021-09-22,229
中国通号研究设计院集团2022年校园招聘,2021-09-22,484
中国电信-翼支付2022年度校园招聘,2021-09-22,232
萧山互联网高科技人才校园云聘会,2021-09-22,146
浙江浙达能源科技有限公司,2021-09-22,143
中国联合网络通信有限公司佛山市分公司,2021-09-22,147
交通银行无锡分行2022年度校园招聘公告,2021-09-22,211
迈克生物股份有限公司专场招聘会（南校区）,2021-09-22,206
国家电网有限公司直属单位—国网信息通信产业集团有限公司2022届校园招聘公告,2021-09-24,607
厦门韫茂科技有限公司,2021-09-23,181
元象XVERSE2022校园招聘,2021-09-23,189
鸿坤物业集团公司  鸿图计划-“鸿雁生”2022年校园精英招聘季,2021-09-23,165
中国民生银行2022届毕业生“未来银行家”  秋季校园招聘公告,2021-09-22,174
中国人民解放军第五七二一工厂2022年校园招聘简章,2021-09-23,308
神钢集团  无锡压缩机股份有限公司,2021-09-25,150
 “乐享生活  动感世界”乐动机器人2022校园招聘全面启动,2021-09-23,221
西门子医疗【2022校园招聘简章】,2021-09-22,300
内蒙古伊利实业集团2022年校园招聘,2021-09-22,211
西安赛格商业运营管理有限公司,2021-09-26,238
象帝先-2022秋季招聘,2021-09-24,179
紫金矿业集团  2022届“金榜生”校园招聘简章,2021-09-26,236
科顺防水科技股份有限公司2022届校园招聘,2021-09-25,151
新乡航空工业（集团）有限公司2022届校园招聘,2021-09-23,290
沛顿科技（深圳）有限公司,2021-09-22,172
联咏电子科技（西安）有限公司2022届校招（软件/算法）,2021-09-24,247
联咏电子科技（西安）有限公司 2022届校园招聘简章（软件/算法）,2021-09-22,211
福信集团有限公司2022届校园招聘简章,2021-09-24,229
泰瑞数创 2022 届秋季校园招聘简章,2021-09-25,149
银河电力集团股份有限公司招聘简章2022,2021-09-23,216
成谷科技2022届校园招聘  ——邀请你和我们一起开启高速公路自动驾驶时代的元年,2021-09-23,200
万科商业万IN生2022校园招聘,2021-09-22,181
华能智链2022届管培生校园招聘简章,2021-09-22,253
苏州旭创科技2022年校招,2021-09-22,215
南京德锐企业管理咨询有限公司,2021-09-24,169
广发证券领先计划  2021年秋季校园招聘,2021-09-26,203
中交第一公路勘察设计研究院有限公司2022秋季校园招聘,2021-09-23,210
逐梦尧云，启航未来丨尧云科技2022届校园招聘,2021-09-23,248
广州金升阳科技有限公司2022&2023届秋季校园招聘,2021-09-23,167
浙江精功科技股份有限公司,2021-09-24,188
中国船舶重工集团公司第七二六研究所,2021-09-22,267
新疆农村信用社（农商银行）2021年秋季招录公告,2021-09-22,302
你远比想象中更优秀！通联金融2022届校招公告,2021-09-24,232
桂林优利特医疗电子有限公司2022届校园招聘,2021-09-24,162
中国电子科技集团公司第十研究所,2021-09-26,264
中国铁塔甘肃省分公司2022年校园招聘,2021-09-25,165
浦发银行北京分行2022校园招聘正式启动,2021-09-23,185
安波福电子（苏州）有限公司,2021-09-23,166
广州安凯微电子股份有限公司,2021-09-26,216
朱光亚战略科技研究院及上海工物高技术产业发展有限公司2022校园招聘,2021-09-22,218
中国邮政储蓄银行甘肃省分行2022年度校园招聘公告,2021-09-22,197
“芯”之所向，“瞳”创未来 —芯瞳半导体2022届校园招聘正式启动,2021-09-26,221
富士康工业互联网股份有限公司,2021-09-23,259
成都新易盛通信2022届校园大使招募,2021-09-24,204
【浦汇金英 创造卓越】浦发银行福州分行2022年度校园招聘启事,2021-09-23,154
中国海洋石油集团有限公司招聘公告,2021-09-22,215
南京信息技术研究院2022年校园招聘简章,2021-09-22,412
深圳宝新创2022届毕业生招聘,2021-09-26,169
成都新易盛通信技术股份有限公司2022届校园招聘,2021-09-24,243
成谷科技2022届校园招聘 ——邀请你和我们一起开启高速公路自动驾驶时代的元年,2021-09-26,306
中国民生银行股份有限公司银川分行,2021-09-23,182
浙江巨磁智能技术有限公司【长沙研发中心】-22届秋季校园招聘,2021-09-23,169
中国建设银行广西区分行2022年度校园招聘公告,2021-09-26,173
中国电子科技集团公司第十研究所,2021-09-23,662
中通快递2022届校园招聘来啦,2021-09-22,241
天津农商银行2022届校园招聘启事,2021-09-26,149
旋智电子科技（上海）有限公司,2021-09-24,248
北京中电普华信息技术有限公司2022校园招聘,2021-09-23,210
中信证券股份有限公司山西分公司 2022年校园招聘简章,2021-09-23,220
广州文远知行科技有限公司,2021-09-23,157
联咏科技 2022校招持续进行中（软件/算法）--西安,2021-09-26,192
中国网安（含中国电科三十所）2022届校园招聘,2021-09-22,371
苏州艾思兰光电有限公司,2021-09-23,175
9月23日 晚19:00，招商银行西安分行第二场线上宣讲会“岗位云体验”来袭-带你云感受真实工作环境！,2021-09-22,213
空宣-中物院软件中心2022年北京、成都、绵阳三地300+OFFER等你来拿！,2021-09-23,207
深圳市海柔创新科技有限公司,2021-09-26,174
成方金融科技有限公司2022年校园招聘,2021-09-26,198
中国水利水电第七工程局有限公司,2021-09-23,225
此“克”即未来—森思泰克2022届校园招聘,2021-09-23,230
"大普通信2022校园招聘--""芯""程上等你来",2021-09-24,288
重庆长安跨越车辆有限公司招聘简章,2021-09-26,195
上海联影医疗科技有限公司,2021-09-23,227
唐山市环境规划科学研究院（唐山市生态环境宣传教育中心）,2021-09-24,263
杭州凯龙医疗器械有限公司,2021-09-24,173
“无极限，目未来” 2022届极目机器人 校园招聘,2021-09-24,151
招商银行海口分行2022年秋季校园招聘,2021-09-22,180
“红”要有你，“山”耀未来 红山集团2021-2022校园招聘,2021-09-23,217
2022届腾讯双百计划&Topic基金联合校园校招火热来袭！,2021-09-26,234
迈克生物股份有限公司专场招聘会（北校区）,2021-09-24,201
蘑菇街2022届研发岗秋招开始啦！,2021-09-22,269
上海霍莱沃电子系统技术股份有限公司,2021-09-23,198
佳能医疗研发岗：图像算法、软件研发,2021-09-26,202
葛洲坝集团交通投资有限公司  2021年校园招聘简章,2021-09-24,136
中银金融科技有限公司2022全球校园招聘公告,2021-09-26,181
浙江天圣控股集团有限公司,2021-09-24,225
中国卫通集团股份有限公司2022年度校园招聘,2021-09-24,264
美光半导体咨询（上海）有限责任公司,2021-09-23,231
北方广微科技有限公司,2021-09-22,218
相约广电 逐梦前行 陕西广电网络传媒(集团)股份有限公司 2022届秋季校园招聘,2021-09-24,2026
9月27日晚19：00！招商银行西安分行“小招面对面”第三场线上宣讲会，学长学姐与你面对面交流！,2021-09-26,167
兴业银行南宁分行2022校园招聘公告,2021-09-26,161
宏发股份-厦门宏发汽车电子有限公司+2022届毕业生招聘启事,2021-09-23,159
北京百华悦邦科技股份有限公司,2021-09-23,190
奇安信科技集团股份有限公司,2021-09-23,241
珠海格力智能装备有限公司2022届校园招聘,2021-09-24,169
 中航国际2022校园招聘简章,2021-09-24,242
招满即止！2022慧策（北京掌上先机网络科技有限公司）校园招聘,2021-09-24,193
500强化工企业—巴斯夫2022届校园招聘！,2021-09-24,207
深圳市航盛电子股份有限公司,2021-09-23,208
星星充电2022届校园招聘西安电子科技大学专场宣讲会来啦！,2021-09-23,209
航天南湖电子信息技术股份有限公司  2022年校园招聘简章,2021-09-26,300
中国科学院苏州生物医学工程技术研究所校园招聘,2021-09-26,119
中电科技（北京）有限公司,2021-09-23,268
福建中烟工业有限责任公司招聘信息,2021-09-26,193
小米集团新零售管培生2022全球校园招聘,2021-09-24,170
飞思凌杭州分公司2022届秋季校园招聘,2021-09-22,235
药明康德2022校园招聘招生简章（WuXi Chemistry）,2021-09-24,265
超30家半导体上市公司云集！集微半导体企业2022联合校招会！,2021-09-23,465
湖南明康中锦医疗科技发展有限公司校园招聘,2021-09-24,149
陕西水利水电工程集团有限公司,2021-09-26,234
深圳市世纪创新显示电子有限公司,2021-09-24,200
“欣起点·奕起来”——欣奕华集团2022校园招聘简章,2021-09-26,170
浙江臻镭科技股份有限公司2022届校招,2021-09-23,183
中国工商银行福建分行2022年度秋季校园招聘公告,2021-09-24,172
成都稳海半导体有限公司2022年校园招聘--模拟、器件、版图工程师,2021-09-26,263
我为蓝天而来——2022福建龙净脱硫脱硝工程有限公司校园招聘简章,2021-09-24,159
中意未来 泰聚英才 新疆中泰集团2022年校园招聘,2021-09-22,201
河南移动2022校园招聘,2021-09-22,204
烟台东方威思顿电气有限公司烟台东方威思顿电气有限公司2022届校园招聘简章,2021-09-21,189
SNTO晟通集团2022届“拓荒者”校园招聘简章,2021-09-22,175
青岛易来智能科技股份有限公司,2021-09-18,167
北京比特大陆科技有限公司2022届校园招聘,2021-09-22,164
为梦想赋能  ——航嘉集团2022届校园招聘,2021-09-22,136
中国移动福建公司2022年秋季校园招聘简章,2021-09-18,225
天水七四九电子有限公司,2021-09-20,247
中国光大银行信息科技部2022年  秋季校园招聘启事,2021-09-22,171
浙江清华柔性电子技术研究院2022届全球校园招聘启动啦！,2021-09-18,160
中科芯检测事业部（中微腾芯）22年校园招聘,2021-09-22,191
苏州佳世达电通有限公司,2021-09-22,161
中移互联网2022秋季校园招聘简章,2021-09-18,295
金地商置集团2022届『金鹰计划』校园招聘,2021-09-22,141
寒武纪2022届校园招聘全面进行中,2021-09-19,263
桐昆集团2022年秋招,2021-09-18,276
众合科技2022届秋季校园招聘简章,2021-09-22,163
2022施耐德电气秋季校园招聘正式启动！,2021-09-18,235
中国网安（含中国电科三十所）2022届校园招聘,2021-09-22,174
中国兵器装备集团自动化研究所有限公司,2021-09-22,268
浦汇金英 创造卓越  浦发银行广州分行2022年度校园招聘启事,2021-09-22,137
地产百强-朗诗地产2022校园招聘,2021-09-22,138
数码视讯科技集团2022届校园招聘,2021-09-22,221
“追逐梦想  共筑未来”  中国医药集团联合工程有限公司  2022校园招聘,2021-09-22,171
智·在未来 丨成都智明达电子股份有限公司2022届校园招聘,2021-09-18,211
【优必选科技】2021年校园招聘正式启动,2021-09-22,145
中国平安财产保险股份有限公司科技中心招聘简章,2021-09-18,209
水滴2022校园招聘简章,2021-09-18,253
先临三维科技股份有限公司,2021-09-22,223
合肥悦芯半导体科技有限公司2022届秋季校园招聘简章,2021-09-18,261
江苏杰士德集团招聘简章,2021-09-22,138
佳都科技集团2022校园招聘简章,2021-09-18,207
招商银行股份有限公司银川分行,2021-09-22,146
中国建设银行股份有限公司陕西省分行,2021-09-18,242
追求卓越 超越自我  ——中国核能电力股份有限公司2022年校园招聘,2021-09-22,144
航天九院西安电子科技大学宣讲招聘公告,2021-09-21,488
合容电气股份有限公司,2021-09-22,147
中国通信服务四川公司2022届秋季  校园招聘,2021-09-22,146
“梦想靠岸”招商银行南京分行2022届秋季校园招聘启事,2021-09-21,163
西安航天精密机电研究所,2021-09-18,382
上海富瀚微电子股份有限公司2022届校园招聘,2021-09-22,161
中国联合工程有限公司2022届校园招聘,2021-09-18,179
中国能源建设集团广东省电力设计研究院有限公司2022校园招聘,2021-09-21,324
丰疆智能科技股份有限公司 2022届校园招聘公告,2021-09-18,163
